130,"PENCEGAHAN PENCEMARAN MINYAK OLEH KAPAL LAUT 
DALAM HUKUM INTERNASIONAL DAN IMPLEMENTASINYA
 DI INDONESIA
","., YUNI RAMASITA","Efek tumpahan minyak di laut membawa kerugian yang sangat besar bagi negara yang sebagian besar wilayahnya adalah perairan. Kerusakan ekosistem di laut membuat produktivitas laut menjadi tidak seimbang sehingga banyak biota laut yang rusak dan/atau mati, ini juga berdampak buruk terhadap kesejahteraan nelayan.Banyaknya pencemaran laut yang terjadi membuat negara-negara berupaya untuk mengatasi pencemaran minyak di laut. Tujuan penelitian ini adalah untuk mengetahui dan menjelaskan ketentuan-ketentuan internasional yang mengatur pencegahan pencemaran minyak yang dilakukan oleh kapal laut dan implementasinya dalam peraturan perundang-undangan Indonesia. 

Jenis penelitian ini adalah yuridis normatif dengan tipe penelitian deskriptif. Data yang digunakan adalah data primer dan sekunder, sedangkan metode pengumpulan data yang digunakan adalah studi pustaka dengan cara mengidentifikasi, mengklasifikasikan dan menyusun secara sistematis untuk menarik kesimpulan. 

Hasil penelitian menunjukkan bahwa Pengaturan tentang pencegahan pencemaran laut yang disebabkan oleh kapal dalam Convention for the Safety Life At the Sea (SOLAS) 1974 dan United Nations Convention on the law of the Sea (UNCLOS) 1982 telah memuat secara rinci dan jelas upaya pencegahan pencemaran bisa dilakukan dengan baik oleh setiap negara, dalam Undang-Undang Republik Indonesia Nomor 16 tahun 2008 tentang Pelayaran dan Peraturan Pemerintah Nomor 19 Tahun 1999 tentang Pengendalian Pencemaran dan/atau Perusakan di Laut Indonesia juga memuat beberapa ketentuan yang sama. Berdasarkan peraturan internasional dan peraturan hukum nasional Indonesia sudah sesuai namun dalam pelaksanaannya di lapangan setiap perusahaan kapal belum dengan teliti memeriksa setiap kelengkapan dan kondisi  kapal sehingga terjadi beberapa kecelakaan yang mengakibatkan kerusakan dan kerugian, yang pada gilirannya akan menimbulkan pencemaran.

Kata kunci : pencegahan pencemaran minyak, kapal, laut, Implementasi.
",2011-10-14,digilib_unila,http://digilib.unila.ac.id/106/1/cover%20dalem.pdf,2026-04-14 10:12:22.885321+07
131,"VALIDASI METODE ANALISIS Pb DENGAN MENGGUNAKAN FLAME
SPEKTROFOTOMETER SERAPAN ATOM (SSA) UNTUK STUDI
BIOGEOKIMIA DAN TOKSISITAS LOGAM TIMBAL (Pb)
PADA TANAMAN TOMAT (Lycopersicum esculentum)(VALIDATION ANALYSIS METHOD OF Pb USING FLAME ATOMIC
ABSORPTION SPECTROSCOPY FOR BIOGEOCHEMISTRY
AND TOXICITY STUDIES OF LEAD IN TOMATO
(Lycopersicum esculentum))","Suratno, Eko Wijianto","spektrofotometer serapan atom untuk studi biogeokimia dan toksisitas logam
timbal (Pb) pada tanaman tomat (Lycopersicum esculentum). Konsentrasi logam
Pb ditentukan dengan menggunakan spektrofotometer serapan atom (SSA) AA
240FS dengan menggunakan enam validasi metode yaitu: linearitas, selektivitas,
limit deteksi, limit kuantifikasi, presisi, dan akurasi. Validasi metode pada
penentuan kadar Pb dalam tanaman menunjukan nilai koefisien korelasi (r) Pb
adalah 0,9982, nilai limit deteksi untuk sampel tanaman dan tanah berturut-turut
adalah 0,595 dan 1,984 ppm, sedangkan limit kuantifikasi berturut-turut adalah
0,787 dan 2,623 ppm, presisi dengan nilai relatif standar deviasi (RSD) < 5 %, dan
akurasi pada rentang 92 - 102 %. Berdasarkan hasil penelitian, akumulasi logam
timbal pada bagian tanah lebih besar dibandingkan bagian tumbuhan untuk semua
konsentrasi pemaparan. Hasil analisis menunjukkan bahwa akumulasi logam
timbal terbesar pada tanaman terdapat pada bagian akar, diikuti bagian daun,
batang dan buah.
Kata kunci: Validasi metode analisis, Pb, Tomat, SSA. (Validation analysis method of Pb using flame atomic absorption spectroscopy had
been conducted for biogeochemistry and toxicity studies of lead in tomato
(Lycopersicum esculentum). The method was conducted by an Atomic
Absorption Spectroscopy (AAS) AA 240FS with six validation method
parameters including: linearity, selectivity, limit of detection, limit of
quantification, precision, and accuration. Validation method of determining the
concentration of lead in tomato plants and soil showed a correlation coefficient is
0,9982, limit of detection for plants and soil are 0,595 and 1,984 ppm, limit of
quantification are 0,787 and 2,623 ppm, precision with relative standard deviation
(RSD) values < 5 %, and percent recovery in the range 92 – 102 %.
Accumulation of lead in the soil is greather than the plant parts. The
concentrations of lead was detected in all part of the tomato plant root, leaves,
stems, and fruit. The highest exposure are at the roots and the lowest is fruit.
Keywords: Validation method analysis, Pb, Tomato, AAS.)",2013-12-23,digilib_unila,http://digilib.unila.ac.id/107/1/COVER%20DALAM.pdf,2026-04-14 10:12:22.890119+07
137,"KARAKTERISASI RESERVOIR HIDROKARBON DENGANMETODE INVERSI IMPEDANSI AKUSTIK DAN 
MULTIATRIBUT PADA LAPANGAN “PRB’ ","., Syayid Anwar Sukarno ","Metoda inversi impedansi akustik dan analisis multiatribut merupakan metode 
geofisika yang digunakan untuk mengetahui properti batuan yang  pada suatu daerah target tertentu di bawah permukaan bumi. Teknik Inversi merupakan backward modeling yaitu dari hasil bagi seismic section dengan wavelet. Teknik membuat model bawah permukaan dengan data seismik dan data sumur sebagai kontrol. Penelitian ini melakukan analisis impedansi akustik dan multiatribut pada layer TKF dan BKF pada formasi Keutapang. Crossplot dilakukan untuk mengetahui properti log. Analisis parameter petrofisika (porosity, P-Wave, dan density) yang didekati dengan AI akan mempermudah interpretasi dalam mengkaraterisasi properti batuan. Zona prospek pada layer TKF memiliki nilai AI 17.470 s.d. 18.600 ((ft/s)*(gr/cc)) dengan 650 s.d. 700 (m/s) dekat sumur PRB-26 pada struktur antiklin kemudian terdapat juga zona pada ujung antiklin dekat sumur PRB-29 dengan nilai AI 17.250 s.d. 18.500 ((ft/s)*(gr/cc)) dengan 675 s.d. 750 (m/s) pada peta struktur waktu. Zona prospek pada layer BKF memiliki nilai AI 19.600 s.d. 20.800 ((ft/s)*(gr/cc)) dan 850 s.d. 950 (m/s) arah baratlaut dari sumur PRB-29 yaitu pada struktur ujung tutupan antiklin. Sebaran properti batuan dapat dipetakan dengan baik pada layer TKF zona pertama memiliki porositas 25 s.d. 27 % dengan kecepatan batuan 2.320 s.d. 2.450 (m/s), dan densitas yaitu 2,325 s.d. 2,478 (gr/cc) kemudian pada zona kedua memiliki porositas 25,6 s.d. 27,5 % dengan densitas 2.43 s.d. 2,56 (gr/cc) dan memiliki kecepatan batuan 2.300 s.d. 2.530 m/s. Sebaran properti pada layer BKF memiliki nilai porositas  21,60 s.d. 22,5 % dengan kecepatan batuan 2.700 s.d. 2.900 m/s dan densitas 2,285 s.d. 2,456 gr/cc. 
 Kata kunci :  Teknik Inversi, Impedansi Akustik, Multiatribut ",2013-05-16,digilib_unila,http://digilib.unila.ac.id/114/1/COVER%20DALAM.pdf,2026-04-14 10:12:22.926896+07
133,"SINTESIS DAN KARAKTERISASI SERTA UJI PENDAHULUAN AKTIVITAS ANTIKAKER BEBERAPA SENYAWA ORGANOTIMAH(IV) 2-NITROBENZOAT
TERHADAP SEL LEUKIMIA L-1210 (SINTHESIS, CHARACTHERIZATION, AND PRELIMINARY SCREENING ANTICANCER ACTIVITY OF SOME ORGANOTIN(IV)
2-NITROBENZOATE COMPOUNDS AGAINTS LEUKEMIA L-1210)","Mahmudi, Khoirul Umam","Telah dilakukan sintesis senyawa dibutiltimah(IV) di-2-nitrobenzoat, difeniltimah(IV) di-2-nitrobenzoat dan trifeniltimah(IV) 2-nitrobenzoat dengan senyawa awal dibutiltimah(IV) diklorida, difeniltimah(IV) diklorida, trifeniltimah(IV) klorida, dan asam-2-nitrobenzoat. Dengan variasi waktu 3, 4, dan 5 jam diperoleh rendemen tertinggi sebesar 84,22% untuk dibutiltimah(IV) di-2-nitrobenzoat, 81,89% untuk difeniltimah(IV) di-2-nitrobenzoat, dan 85,67% untuk trifeniltimah(IV) 2-nitrobenzoat dengan waktu refluks optimum masing-masing empat (4) jam. Masing-masing senyawa hasil dengan rendemen tertinggi dikarakterisasi dengan menggunakan spektrofotometer IR, spektrofotometer UV-Vis, dan microelemental analyzer, dan dari hasil karakterisasi menunjukkan kemurnian dari senyawa hasil. Kemudian dilakukan pengujian pendahuluan aktivitas antikanker terhadap sel leukimia L-1210 diperoleh nilai IC50 untuk dibutiltimah(IV) di-2-nitrobenzoat sebesar 24,66 μg/mL, difeniltimah(IV) di-2-nitrobenzoat sebesar 9,87 μg/mL, dan trifeniltimah(IV) 2-nitrobenzoat sebesar 3,52 μg/mL. (Syntheses of dibutyltin(IV) di-2-nitrobenzoate, diphenyltin(IV) di-2-nitrobenzoate and triphenyltin(IV) 2-nitrobenzoate compounds with starting materials of dibutyltin(IV) dichloride, diphenyltin(IV) dichloride, triphenyltin(IV) chloride, and 2-nitrobenzoic acid have been performed. The time variation used were 3, 4, and 5 hours, where the highest percentage yield were 84.22% for dibutyltin(IV) di-2-nitrobenzoate, 81.89% for diphenyltin(IV) di-2-nitrobenzoate, and 85.67% for triphenyltin(IV) 2-nitrobenzoate at the optimum reflux time of four (4) hours. Each compound with the highest percent yield was characterized using IR spectrophotometer, UV-Vis spectrophotometer, and microelemental analyzer, and the results of characterization showed that the compounds synthesized were quite pure. The preliminary screening of anticancer activity against leukemia L-1210 cells was performed and the IC50 values obtained for dibutyltin(IV) di-2-nitrobenzoate, diphenyltin(IV) di-2-nitrobenzoate and triphenyltin(IV) 2-nitrobenzoate were 24.66 mg/mL, 9.87 mg/mL, 3.52 mg/mL, respectively.)",2013-12-23,digilib_unila,http://digilib.unila.ac.id/110/2/Cover%20Dalam.pdf,2026-04-14 10:12:22.903343+07
134,"PENERAPAN KOREKSI STATIK TIME DOMAIN ELEKTROMAGNETIK (TDEM)  PADA DATA MAGNETOTELLURIK (MT)  UNTUK 
PEMODELAN RESISTIVITAS LAPANGAN PANAS BUMI “SS”","Hardiwan, Putri Hardini","Metode magnetotellurik (MT) merupakan metode elektromagnetik pasif yang memiliki jangkauan kedalaman yang lebih dalam dari metode geofisika lainnya. Hasil pengukuran magnetotellurik mengalami pergeseran statik akibat perbedaan topografi dan heterogenitas lapisan permukaan, sehingga perlu dilakukan koreksi statik Time Domain Elektromagnetik (TDEM). TDEM merupakan metode elektromagnetik aktif yang akurat untuk lapisan dangkal. Hasil pengolahan  koreksi statik pada semua lintasan daerah penelitian memiliki persebaran nilai resistivitas yang lebih akurat. Perkiraan lapisan penudung ( claycap) terlihat jelas pada lintasan ke-3 disekitar titik MT-19 dan MT-18 dengan nilai resistivitas < 10 ohm.m dan pada kedalaman 1000 meter msl. 
Kata kunci: Magnetotellurik, TDEM, Claycap, Resistivitas.",2013-05-13,digilib_unila,http://digilib.unila.ac.id/111/1/Cover%20dalam.pdf,2026-04-14 10:12:22.907691+07
135," 
KARAKTERISASI RESERVOIR HIDROKARBON DENGAN METODE INVERSI IMPEDANSI AKUSTIK DAN 
MULTIATRIBUT PADA LAPANGAN “PRB’ ","., Syayid Anwar Sukarno ","Metoda inversi impedansi akustik dan analisis multiatribut merupakan metode 
geofisika yang digunakan untuk mengetahui properti batuan yang  pada suatu daerah target tertentu di bawah permukaan bumi. Teknik Inversi merupakan backward modeling yaitu dari hasil bagi seismic section dengan wavelet. Teknik membuat model bawah permukaan dengan data seismik dan data sumur sebagai kontrol. Penelitian ini melakukan analisis impedansi akustik dan multiatribut pada layer TKF dan BKF pada formasi Keutapang. Crossplot dilakukan untuk mengetahui properti log. Analisis parameter petrofisika (porosity, P-Wave, dan density) yang didekati dengan AI akan mempermudah interpretasi dalam mengkaraterisasi properti batuan. Zona prospek pada layer TKF memiliki nilai AI 17.470 s.d. 18.600 ((ft/s)*(gr/cc)) dengan 650 s.d. 700 (m/s) dekat sumur PRB-26 pada struktur antiklin kemudian terdapat juga zona pada ujung antiklin dekat sumur PRB-29 dengan nilai AI 17.250 s.d. 18.500 ((ft/s)*(gr/cc)) dengan 675 s.d. 750 (m/s) pada peta struktur waktu. Zona prospek pada layer BKF memiliki nilai AI 19.600 s.d. 20.800 ((ft/s)*(gr/cc)) dan 850 s.d. 950 (m/s) arah baratlaut dari sumur PRB-29 yaitu pada struktur ujung tutupan antiklin. Sebaran properti batuan dapat dipetakan dengan baik pada layer TKF zona pertama memiliki porositas 25 s.d. 27 % dengan kecepatan batuan 2.320 s.d. 2.450 (m/s), dan densitas yaitu 2,325 s.d. 2,478 (gr/cc) kemudian pada zona kedua memiliki porositas 25,6 s.d. 27,5 % dengan densitas 2.43 s.d. 2,56 (gr/cc) dan memiliki kecepatan batuan 2.300 s.d. 2.530 m/s. Sebaran properti pada layer BKF memiliki nilai porositas  21,60 s.d. 22,5 % dengan kecepatan batuan 2.700 s.d. 2.900 m/s dan densitas 2,285 s.d. 2,456 gr/cc. 
 Kata kunci :  Teknik Inversi, Impedansi Akustik, Multiatribut ",2013-04-14,digilib_unila,http://digilib.unila.ac.id/112/1/COVER%20DALAM.pdf,2026-04-14 10:12:22.91742+07
136,"FERMENTASI HIDROLISAT ONGGOK DENGAN MENGGUNAKAN
MIKROBA ENDOFITIK (FERMENTATION OF ONGGOK HYDROLYZATES BY ENDOPHYTIC MICROBES)","Marto, Muhamad Amin","Penelitian itu dilakukan untuk mengisolasi mikroba endofitik dari kulit kayu raru
dan menguji potensi mereka dalam fermentasi hidrolisat onggok singkong untuk
produksi bioetanol. Enam isolat yang diperoleh, diuji untuk fermentasi, dan
hanya satu isolat yang memiliki kemampuan menghasilkan bioethanol dengan
konsentrasi 15,5%, dengan konsentrasi gula pereduksi hampir 100 % dari onggok
singkong menggunakan hidrolisis asam. (This study was carried out to isolate endophytic microorganims form the bark of
raru tree and to test their potential for fermenting of hydrolizate of solid cassava
waste for bioethanol production. Six isolate were obtained and tested for
fermentation, and it was found that one isolate exhibited the ability to produce
bioethanol with the concentration of 15,5 %, with the concentration of reducing
sugar of practically 100 % from solid cassava waste use the hydrolysis of acid.)",2013-12-23,digilib_unila,http://digilib.unila.ac.id/113/1/COVER%20DALAM.pdf,2026-04-14 10:12:22.92216+07
38,"Praktik Manajemen CSR (tanggung jawab sosial perusahaan) 
PT. GGPC Lampung Tengah
"," Wildan, Abdurrahman Wildan","Penelitian ini bertujuan untuk mengetahui bagaimana proses praktik penerapan program Corporate Social Responsibility PT. GGPC Lampung Tengah yang bergerak di bidang pengalengan makanan khususnya pengalengan nanas sebagai komoditi ekspor. Tipe penelitian yang digunakan adalah deskriptif dengan pendekatan kualitatif. lokasi penelitian ini dilakukan PT. GGPC yang bertempat di daerah lampung tengah. 

Hasil penelitian ini menunjukkan bahwa PT. GGPC Lampung Tengah menerapkan program Corporate Social Responsibility menggunakan empat tahapan yaitu tahapan perencanaan, implementasi, pelaporan dan evaluasi dalam penarapan setiap program yang ada. Praktik penerapan program Corporate Social Responsibility PT.GGPC di Lampung Tengah yang melibatkan masyarakat, pemeritah serta pihak perusahaan sebagai regulataor atas terlaksananya program-program Corporate Social Responsibility adalah dalam upaya untuk meningkatkan ekonomi masyarakat sekita, pelesatarian alam dan kestabilan antara perusahaan dan masyarakat sekitar perusahaan. proses serta tindakan subjek yang telibat di dalamnya, karena penelitian ini meneliti proses praktik manajemen implementasi program Corporate Social Responsibility PT.GGPC di Lampung Tengah yang sebagian dari prosesnya sudah dijalankan. Sehingga harus merunut kebelakang melalui data-data yang dikumpulkan dilapangan dari tahap perencanaan, implementasi, pelaporan hingga evaluasi.

Kata kunci : Tanggung Jawab Sosial P¬¬erusahaan.
",2011-01-02,digilib_unila,http://digilib.unila.ac.id/4/1/ABSTRAK.pdf,2026-04-14 10:12:21.978645+07
43,"RANCANG BANGUN KONVEYOR PENYORTIRAN BARANG DENGAN PENGENALAN POLA BENTUK DAN WARNA MENGGUNAKAN 
WE B C A M  ","., Rudi Hasudungan Hutabarat ","Pada penelitian ini dirancang sebuah konveyor yang dapat menyortir sebuah barang, dimana barang yang akan disortir dikenali terlebih dahulu polanya. Penelitian ini merupakan lanjutan dari penelitian sebelumnya yakni membuat konveyor yang membedakan bentuk dan panjang sebuah balok menggunakan sensor ulrasonik. Perancangan konveyor yang akan dibuat  dapat mengenali pola bentuk lingkaran, dan pola oval atau bukan keduanya.  Setelah pola bentuk dikenali, maka  pola warna juga akan dikenali sehingga konveyor tersebut dapat mengenali sebuah benda berdasarkan pola bentuk dan pola warna sehingga dapat dikenakan tindakan lebih lanjut, yakni barang barang tersebut diloloskan atau dibuang. Metode yang digunakan pada pengenalan pola bentuk adalah menghitung nilai matriks pada citra, apabila nilai matriks telah diperoleh selanjutnya mengklasifikasikan citra tersebut ke kategori matriks lingkaran atau oval. Pada pengenalan pola warna digunakan metode perhitungan nilai H ue dari sebuah citra, apabila telah diketahui nilai pikselnya maka citra dapat diklasifikasikan warnanya. Penyortiran barang berhasil dilakukan sesuai dengan inisialisasi yang diberikan, apabila inisialisasi bentuk oval yang diberikan maka objek yang berbentuk  oval akan diloloskan dan selain itu akan dibuang. Hal serupa juga terjadi pada penyortiran objek berwarna, apabila inisialisasi warna merah diberikan maka objek yang memiliki warna merah akan diloloskan selain itu akan dibuang. Diperoleh galat sebesar 10% pada pengenalan bentuk lingkaran, 10% pada pengenalan bentuk oval, 0% pada pengenalan warna merah, 10% pada pengenalan warna hijau dan 10% pada pengenalan warna kuning.   Kata kunci: Matriks, piksel, konveyor. ",2013-02-19,digilib_unila,http://digilib.unila.ac.id/12/1/cover.pdf,2026-04-14 10:12:22.179272+07
45,"RANCANG BANGUN SISTEM PAKAR UNTUK MENDIAGNOSA PENYAKIT TANAMAN CABAI 
DENGAN METODE FORWARD CHAINING  ","., Anas Anshori ","Tanaman cabai dapat diserang berbagai macam penyakit, penyakit tersebut dapat 
diketahui dari gejala-gejala yang ditimbulkannya, akan tetapi untuk mengetahui secara tepat jenis penyakit yang menyerang cabai tersebut, memerlukan seorang pakar/ahli pertanian. Sedangkan jumlah pakar pertanian terbatas dan tidak dapat mengatasi permasalahan petani dalam waktu yang bersamaan, sehingga diperlukan suatu sistem yang mempunyai kemampuan seperti seorang pakar, yang mana di dalam sistem ini berisi pengetahuan keahlian seorang pakar pertanian mengenai penyakit dan gejala tanaman cabai.  Pada penelitian ini dirancang sistem pakar berbasis desktop menggunakan basis aturan (rule based reasoning) dengan metode inferensi forward chaining yang dimaksudkan untuk membantu petani dalam mendiagnosa penyakit tanaman cabai. Metode dalam pembuatan program sistem pakar ini meggunakan metode sekuensial linear yaitu : analisis kebutuhan, perancangan, pengkodean, pengujian dan implementasi. Sistem pakar diagnosa penyakit tanaman cabai berbasis desktop ini dikembangkan menggunakan Visual Basic dan Visual Data Manager sebagai penyimpanan datanya, mempunyai keunggulan dalam kemudahan akses dan kemudahan pemakaian.  Sistem pakar ini mampu melakukan diagnosa penyakit yang diderita oleh tanaman cabai dengan cara mengajukan gejala-gejala penyakit pada saat pemeriksaan. Berdasarkan gejala-gejala yang dipilih tersebut, sistem ini akan memberikan hasil diagnosis kemudian saran terapi, saran pencegahannya dan daftar gejala yang lebih spesifik.   Kata Kunci: Sistem Pakar, basis aturan, Visual Basic, Visual Data Manager, Forward Chaining. ",2013-03-18,digilib_unila,http://digilib.unila.ac.id/14/1/COVER%20DALAM.pdf,2026-04-14 10:12:22.272671+07
48,"OPTIMASI PENJADWALAN PEMBANGKIT TERMIS PADA SISTEM KELISTRIKAN LAMPUNG MENGGUNAKAN METODE PSO (Particle 
Swarm Optimization). 
 ","., Ayu Vertiyani","  
Penjadwalan pembangkit merupakan salah satu hal yang penting dalam operasi sistem tenaga listrik. Tujuan dasar dari penjadwalan yang optimal adalah mengatur pembebanan unit pembangkit dengan biaya seekonomis mungkin dengan tetap memperhatikan beberapa kendala. Pengoperasian pembangkit secara ekonomis dipengaruhi oleh besarnya kebutuhan beban, karakteristik pembangkit, batas kapasitas daya maksimum dan minimum pembangkit, biaya bahan bakar pada tiap unit pembangkit, dan rugi-rugi jaringan transmisi dari pembangkit ke beban.  Penelitian ini bertujuan untuk mendapatkan kombinasi yang optimal dari penjadwalan pembangkit termal dengan biaya yang ekonomis pada sistem kelistrikan Lampung. Kombinasi-kombinasi yang  dilakukan pada penelitian ini didasarkan pada kondisi beban tertentu dari pemilihan jumlah daya yang dibangkitkan oleh beberapa pembangkit yang bekerja dalam kurun waktu 168 jam.  Solusi ekonomis yang digunakan untuk mencari nilai yang paling optimal dalam meminimasi biaya pembangkitan selama 168 jam adalah metode PSO (Particle Swarm Optimization). Hasil kombinasi unit pembangkit dengan menggunakan metode PSO pada saat beban puncak sebesar 614,7 MW adalah kelima pembangkit utama yang terdiri dari PLTA Way Besai, PLTA Batutegi, PLTU New Tarahan, PLTU Sebalang, dan PLTP Ulubelu berada pada kondisi on dengan total biaya yang dihasilkan sebesar $ 18752,6908, sedangkan PLTD Teluk Betung, PLTD Tarahan, dan PLTD Tegineneng berada dalam kondisi off dan tidak terhubung ke sistem. 
 Kata Kunci : Penjadwalan Ekonomis, Unit Commitment, Particle Swarm 
         Optimization. ",2013-05-17,digilib_unila,http://digilib.unila.ac.id/17/1/COVER%20DALAM.pdf,2026-04-14 10:12:22.330363+07
55,ANALISIS PROSES KOMUNIKASI DAN UNJUK KERJA ANTARA TERMINAL PENGGUNA DAN SERVER APLIKASI PADA JARINGAN INTERNET PROTOCOL MULTIMEDIA SUBSYSTEM TERINTEGRASI,"Darmadi, Oktaviana Damayanti","Internet Protocol Multimedia Subsystem (IMS) dikembangkan untuk menyediakan suatu arsitektur jaringan baru yang memungkinkan konvergensi antara data-suara, dan teknologi serta aplikasi jaringan bergerak lainnya melalui basis Internet Protocol (IP). IMS menggunakan Session Initiation Protocol (SIP) untuk melakukan proses-proses pensinyalan. Penelitian ini membahas proses komunikasi dan beberapa parameter Quality of Service (QoS) pada jaringan IMS terintegrasi, yang meliputi jitter, max delta, delay, throughput, dan packet loss. QoS diukur dengan beberapa scenario layanan, yaitu panggilan suara, panggilan dengan video, dan pesan cepat. Pengujian dan pengukuran dilakukan melalui pengembangan sebuah testbed core network IMS berbasis OpenIMSCore. Pengguna IMS mengakses core network melalui akses jaringan kabel LAN dan jaringan nirkabel WiFi access point. Karakteristik proses komunikasi dan unjuk kerja dari kedua akses tersebut dibandingkan dan dianalisis. Dapat disimpulkan bahwa OpenIMSCore berfungsi dengan baik dalam melayani pengguna, dan menampilkan proses-proses komunikasi yang sesuai dengan standard SIP RFC 3261. Dari hasil uji perbandingan, dapat disimpulkan bahwa QoS dari akses melalui jaringan tetap LAN dan WiFi memenuhi semua syarat dan rekomendasi dari standard ITU-T. Namun, kinerja yang ditunjukkan melalui akses LAN lebih baik dibandingkan dengan akses layanan melalui WiFi pada semua skenario layanan.

Kata kunci : Internet Protocol Multimedia Subsystem (IMS), Internet Protocol (IP), Session Initiation Protocol (SIP), OpenIMSCore, IMS Core Network, Quality of Service (QoS)",2013-10-23,digilib_unila,http://digilib.unila.ac.id/24/1/COVER%20DALAM.pdf,2026-04-14 10:12:22.400129+07
59,"PEMBUATAN SISTEM KENDALI NUMERIK  UNTUK PENGGERAK SISTEM INSPEKSI VISI 
 ","., BAMBANG SULAKSANA ","Alasan umum untuk menerapkan system inspeksi visi otomatis telah didiskusikan oleh Peneliti sebelumnya. Banyak keuntungan inspeksi visi otomatis jika 
dibandingkan inspeksi visual manusia. Sistem inspeksi visi otomatis dapat bekerja tanpa lelah, serta memiliki keakuratan dan kendali mutu yang konsisten. Sistem inspeksi visi dapat mendeteksi adanya cacat yang sulit ditemukan oleh visual 
manusia.Tanpa alat bantu dan dapat beroperasi lebih cepat dibanding visual manusia. Pada system kendali dikenal dua system kendali yaitu sistem kendali lup terbuka dan system kendali lup tertutup. Adapun tujuan yang ingin dicapai dalam penelitan ini adalah untuk membuat system control dari pergerakan kamera yang dikontrol secara simultan oleh sebuah komputer (software) yang dapat digunakan untuk kegiatan inspeksi visi.  Pada penelitian ini akan menggunakan software mach3 CNC sebagai control system kendali pada komputer, stepper motor bipolar sebagai penggerak, dan  driver motor yang digunakan adalah IC L297 dan L298 sebagai pengontrol stepper motor. Alat ukur yang dugunakan untuk pengambilan data menggunakan jangka sorong. Pengujian dilakukan dengan mengukur perpindahan meja kerja kemudian membandingkan nilai pengukuran dengan nilai yang diperintah pada 
computer dengan simulasi gerak translasi sejauh 1cm, 2 cm, 3 cm, 4cm, 5 cm, dan 6 cm.  
Dari pengujian yang telah dilakukan pada masing-masing sumbu pergerakan diperoleh nilai kesalahan rata-rata sebagai berikut: pada sumbu x didapatkan nilai kesalahan rata-rata terbesar adalah 3%. Kemudian pada sumbu z memiliki nilai kesalahan rata-rata terbesar adalah 8.4%.Nilai kompensasi jumlah step yang diberikana dalah 2 kali lipat dari jumlah step yang ideal. Beberapa penyebab nilai kesalahan ditinjau dari pendekatan mekanik yang telah dilakukan, adalah karena cacat pada pitch ulir akibat terkena percikan las pada saat perakitan dan pemasangan roda yang tidak sejajar.  
  Kata kunci :Software Mach3 CNC, Driver L297 &  L298, Stepper Motor- 
bipolar. ",2013-04-18,digilib_unila,http://digilib.unila.ac.id/31/1/COVER%20DALAM.pdf,2026-04-14 10:12:22.422164+07
