65,"PENERAPAN PEMBELAJARAN KOOPERATIF TIPE STAD UNTUK MENINGKATKAN AKTIVITAS DAN HASIL BELAJAR MATEMATIKA
(Studi Pada Siswa Kelas VIII SMP Pelita Bangsa Bandar Lampung Semester Genap Tahun Pelajaran 2012/2013).","Ketut, Komang Widre","Rendahnya aktivitas dan hasil belajar matematika siswa kelas VIII B SMP Pelita Bangsa Bandar Lampung karena pembelajaran yang masih terpusat pada guru di kelas. Siswa bersikap pasif dalam kegiatan pembelajaran sehingga hasil belajar kurang memuaskan. Dengan diterapkannya pembelajaran kooperatif tipe STAD dapat memberikan pengalaman bagi siswa untuk belajar secara aktif dalam kelompok. Tujuan penelitian ini adalah untuk meningkatkan (1) aktivitas belajar dan (2) hasil belajar matematika siswa kelas VIII B SMP Pelita Bangsa Bandar Lampung Tahun Pelajaran 2012/2013. Berdasarkan hasil penelitian dan pem-bahasan diketahui bahwa aktivitas dan hasil belajar matematika siswa dapat ditingkatkan menggunakan pembelajaran kooperatif tipe STAD dengan cara membagi kelompok berdasarkan kemampuan akademik, memberikan presentasi singkat mengenai materi belajar, membagikan LKS kepada kelompok untuk
didiskusikan, membahas secara bersama-sama dan pemberian penghargaan kepada kelompok terbaik serta pemberian tes secara individu.
Berdasarkan hasil analisis aktivitas belajar diketahui bahwa persentase aktivitas siswa siklus I sebesar 50% siswa aktif, pada siklus II meningkat 19% menjadi 69% siswa aktif, dan pada siklus III meningkat sebesar 12% menjadi 81% siswa aktif. Nilai rata-rata hasil belajar siswa pada siklus I adalah 68,74 dengan persentase ketuntasan belajar 50%, kemudian pada siklus II meningkat sebesar 5,51 menjadi 74,25 dengan 68,75% siswa tuntas belajar, dan pada siklus III rata-rata hasil belajar kembali meningkat sebesar 6,69 menjadi 80,94 dengan persen-tase ketuntasan belajar 75%. Berdasarkan hasil penelitian dapat disimpulkan bahwa penerapan pembelajaran kooperatif tipe STAD dapat meningkatkan aktivitas dan hasil belajar matematika siswa.

Kata kunci: aktivitas, hasil belajar, STAD",2013-12-23,digilib_unila,http://digilib.unila.ac.id/39/1/2.%20COVER%20DALAM.pdf,2026-04-14 10:12:22.456399+07
61,"PERENCANAAN GEARBOX  DAN PERHITUNGAN DAYA MOTOR PADA MODIFIKASI DONGKRAK ULIR MEKANIS MENJADI 
DONGKRAK ULIR ELEKTRIK  ",".,   TRI GANANG PANDOYO  ","Dongkrak ulir mekanis merupakan suatu alat angkat yang digunakan oleh pengemudi mobil saat terjadi kerusakan, terutama pada saat roda kendaraan bocor atau kempes. Karena bentuk dan desainnya, maka tidak semua orang dapat dengan mudah mengunakan dongkrak ini terutama kaum wanita. Sehingga dilakukan pemodifikasian dongkrak ulir mekanis menjadi dongkrak ulir elektrik. 
Pemodifikasian dongkrak ini dilakukan dengan cara menambahkan gearbox dan motor dc. Perbandian antara input dan autput pada gearbox adalah 1 : 44,77 dan daya motor dc adalah 160 Watt. Prinsip kerja dongkrak ulir elektrik adalah putaran dari motor dc direduksi oleh gearbox dan diteruskan ke batang ulir pada dongkrak, sedangkan sumber tenaga berasal dari baterai mobil itu sendiri. 
Dari pengujian dongkrak ulir elektrik yang telah dilakukan, didapatkan waktu proses pendongkrakan yaitu: pada motor 3 roda adalah 10 detik, Gran Max PU adalah 12 detik dan Mazda Vantrend adalah 14 detik. Semua data tersebut dibandingkan dengan data dongkrak ulir mekanis. 
    Kata kunci: dongkrak, ulir, mekanis, gearbox, motor dc, dan elektrik ",2013-10-17,digilib_unila,http://digilib.unila.ac.id/33/1/2.%20Cover%20Dalam.pdf,2026-04-14 10:12:22.435282+07
63,"EFEKTIVITAS PELAKSANAAN PROGRAM PEMBANGUNAN RUSUNAWA DALAM PEMENUHAN KEBUTUHAN RUMAH BAGI RAKYAT MISKIN DI BANDARLAMPUNG (Studi Kasus Rusunawa 
Keteguhan Kecamatan Teluk Betung Barat) ","., Aina Safitri ","Tujuan pelaksanaan program pembangunan Rusunawa adalah untuk memenuhi 
kebutuhan rumah yang terbatas khususnya bagi masyarakat berpenghasilan rendah. Pembangunan Rusunawa Bandarlampung diprioritaskan pada upaya penataan dan peremajaan kawasan permukiman padat dan permukiman kumuh kota yang umumnya terletak di sepanjang kawasan pesisir, bantaran sungai dan permukiman padat di pusat kota. Untuk wilayah pesisir Teluk Betung Barat dibutuhkan sekitar 1077 unit rumah sedangkan daya tampung Rusunawa Keteguhan hanya sebanyak 192 unit kamar atau 17,83% sehingga secara kuantitas belum dapat memenuhi dari total jumlah kebutuhan yang ada. 
Permasalahan yang diangkat dalam penelitian ini adalah seberapa efektif  pelaksanaan program pembangunan Rusunawa Keteguhan dalam pemenuhan kebutuhan rumah bagi rakyat miskin di Bandarlampung dengan tujuan untuk mengetahui tingkat pencapaian efektivitas pelaksanaan program tersebut. Objek penelitian difokuskan pada analisis ketepatan sasaran, analisis ketepatan lokasi dan analisis ketepatan subsidi harga. Alat analisis yang digunakan dalam penulisan adalah deskriptif kuantitatif. 
Berdasarkan pengukuran variabel dan kuisioner yang diberikan kepada 20 orang responden, pelaksanaan program pembangunan Rusunawa Keteguhan  diperoleh beberapa kesimpulan yaitu bahwa program ini belum tepat sasaran dikarenakan sebanyak 11 penghuni atau 5,73% bukan berasal dari wilayah pesisir Bandar Lampung melainkan dari luar kota serta propinsi lain, sampai saat ini lokasi pesisir yang menjadi sasaran utama pembangunan rusunawa belum ada perubahan yang signifikan dari kondisi sebelum dibangunnya Rusunawa Keteguhan dan kemampuan bayar penghuni masih mengalami hambatan terutama penghuni pada tingkat penghasilan sebesar Rp100.000,00 sampai Rp500.000,00 per bulan serta dibutuhkan 4 sampai 5 unit lagi bangunan rusunawa untuk memenuhi sisa kebutuhan yang ada yakni sebanyak 885 unit rumah atau 82,17% dari total kebutuhan 1077 unit rumah. ",2011-03-16,digilib_unila,http://digilib.unila.ac.id/37/1/cover.pdf,2026-04-14 10:12:22.443542+07
64,"PENGARUH MODEL PEMBELAJARAN KOOPERATIF TIPE
THINK PAIR SHARE TERHADAP PEMAHAMAN KONSEP MATEMATIS SISWA
(Studi Pada Siswa Kelas VIII SMP Negeri 1 Sekampung Udik TP 2012/2013)","Daud, YULIAN SURYA PRATAMA","Penelitian ini merupakan penelitian eksperimen semu yang bertujuan untuk mengetahui pengaruh model pembelajaran kooperatif tipe Think Pair Share (TPS) terhadap pemahaman konsep matematis siswa. Pembelajaran kooperatif tipe TPS merupakan pembelajaran kelompok dimana siswa diberi kesempatan untuk berfikir mandiri dan saling membantu dengan teman yang lain. Pelaksanaan Think Pair Share meliputi tiga tahap yaitu Think (berpikir), Pairing (berpasangan), dan Sharing (berbagi). Populasi penelitian ini adalah seluruh siswa kelas VIII semester genap SMP Negeri 1 Sekampung Udik tahun pelajaran 2012/2013 yang terdistribusi ke dalam lima kelas. Sampel penelitian adalah siswa kelas VIIIA dan VIIIC yang diambil dengan teknik purposive sampling dengan menggunakan desain penelitian posttest only control design. Data penelitian diperoleh melalui tes pemahaman konsep matematis. Berdasarkan hasil penelitian dan pembahasan diperoleh hasil bahwa model pembelajaran kooperatif tipe TPS berpengaruh
terhadap pemahaman konsep matematis siswa kelas VIII SMP Negeri 1 Sekampung Udik tahun pelajaran 2012/2013.

Kata kunci : Pengaruh, Think Pair Share, Pemahaman Konsep Matematis.",2013-12-23,digilib_unila,http://digilib.unila.ac.id/38/1/COVER%20DALAM.pdf,2026-04-14 10:12:22.45196+07
67,"ANALISIS PENGEMBANGAN POTENSI KECAMATAN KEMILING SEBAGAI PENYANGGA LAJU URBANISASI 
 ","., Dedy Hermansyah ","Urbanisasi merupakan salah satu persoalan kependudukan yang timbul akibat ketidakmerataan pembangunan yang dilakukan selama ini. Untuk mengatasi masalah tersebut maka kebijakan pembangunan ketenagakerjaan perlu melibatkan peran aktif dan kerjasama antar pemerintah daerah dalam penciptaan dan perluasan kesempatan kerja di suatu wilayah.  
Kecamatan Kemiling sebagai salah satu kecamatan di Kota Bandar Lampung memiliki peran penting dalam menyangga urbanisasi, mengingat posisinya yang berbatasan langsung dengan Kecamatan Gedongtatan Kabupaten Pesawaran. Untuk menekan laju urbanisasi maka pengembangan potensi ekonomi yang ada di Kecamatan Kemiling perlu diarahkan pada sektor ekonomi yang merupakan sektor basis serta kemampuannya dalam menciptakan pelipatgandaan tenaga kerja pada sektor nonbasis berdasarkan potensi ekonomi yang ada di wilayahnya.  Permasalahan yang diajukan adalah “Sektor-sektor apa saja yang menjadi sektor basis dan sektor nonbasis, serta berapa besar pelipatgandaan tenaga kerja yang diakibatkan oleh pengembangan sektor basis yang akan menambah kesempatan kerja di sektor nonbasis”. 
Penelitian ini bertujuan untuk mengetahui sektor-sektor ekonomi yang menjadi sektor basis dalam wilayah kecamatan Kemiling dan daerah sekitarnya, serta untuk mengetahui seberapa besar pelipatgandaan tenaga kerja pada sektor nonbasis, sebagai akibat dari pengembangan sektor basis. 
Metode penelitian ini menggunakan teknik analisis model Location Quotient (LQ) dan pelipatgandaan tenaga kerja.  Data yang digunakan adalah data sekunder hasil publikasi Kecamatan Kemiling, Dinas Tenaga Kerja Kota Bandar Lampung dan Badan Pusat Statistik Kota Bandar Lampung, dengan teknik pengumpulan dokumentasi. Hasil perhitungan menunjukkan bahwa dari sembilan sektor ekonomi yang 
dimiliki oleh Kecamatan Kemiling dengan menggunakan analisis LQ dapat disimpulkan bahwa terdapat tiga sektor basis ekonomi dengan nilai LQ > 1 dan terdapat enam sektor nonbasis ekonomi dengan nilai LQ < 1. Sedangkan 12 kecamatan lainnya bervariasi sesuai dengan potensi wilayahnya. Adapun ketiga sektor basis ekonomi tersebut adalah (1) Sektor Pertanian (2) Sektor Bangunan (3) Sektor Jasa-jasa. Sedangkan keenam sektor nonbasis ekonomi tersebut terdiri dari (1) Sektor Pertambangan dan Penggalian (2) Sektor Industri (3) Sektor Listrik, Gas dan 
Air Bersih (4) Sektor Perdagangan, Restoran dan Perhotelan (5) Sektor Pengangkutan dan Komunikasi (6) Sektor Keuangan, Persewaan Bangunan, dan Jasa Perusahaan. 
Nilai rata-rata pelipatgandaan tenaga kerja Kecamatan Kemiling sebesar 1,0433 yang berarti penambahan tenaga kerja sektor basis tidak akan menambah tenaga kerja pada sektor nonbasis ekonomi. 
Dengan demikian disinilah pentingnya peranan pemerintah daerah untuk melakukan atau mengambil kebijakan-kebijakan yang harus diarahkan agar lebih berkonsentrasi pada sektor-sektor basis dan sektor nonbasis, yang dapat berpengaruh baik secara langsung maupun tidak langsung dalam meningkatkan pemerataan pertumbuhan ekonomi, dan mengupayakan penyerapan tenaga kerja yang semaksimal mungkin agar mampu menjadi penyangga dalam menekan laju urbanisasi. 
 ",2011-03-06,digilib_unila,http://digilib.unila.ac.id/41/1/COVER%20DEPAN.pdf,2026-04-14 10:12:22.469157+07
68,"EFEKTIVITAS MODEL PEMBELAJARAN KOOPERATIF TIPE TTW
(THINK TALK WRITE) DITINJAU DARI KEMAMPUAN
KOMUNIKASI MATEMATIS SISWA
(Studi pada Siswa Kelas IX SMP Negeri 2 Ngambur Pesisir Barat
Tahun Pelajaran 2013-2014)","Maulazi, ETI RUZIANA","Penelitian ini merupakan penelitian eksperimen semu yang bertujuan untuk
mengetahui efektivitas model pembelajaran kooperatif tipe TTW (Think Talk
Write) ditinjau dari kemampuan komunikasi matematis siswa dengan
menggunakan posttest-only control-group design. Populasi penelitian adalah
seluruh siswa kelas IX SMP Negeri 2 Ngambur Pesisir Barat Tahun Pelajaran
2013-2014 dengan sampel penelitian adalah siswa kelas IXA dan IXC yang
ditentukan dengan teknik purposive sampling. Data penelitian ini merupakan data
kuantitatif kemampuan komunikasi matematis yang diperoleh melalui tes
kemampuan komunikasi matematis siswa yang berbentuk uraian. Dari penelitian
ini, diperoleh kesimpulan bahwa model pembelajaran kooperatif tipe TTW efektif
ditinjau dari kemampuan komunikasi matematis siswa kelas IX Semester Ganjil
SMP Negeri 2 Ngambur Pesisir Barat Tahun Pelajaran 2013-2014.
Kata Kunci : Efektivitas, Kemampuan Komunikasi Matematis, Think Talk Write",2013-12-23,digilib_unila,http://digilib.unila.ac.id/42/1/3.%20COVER%20DALAM.pdf,2026-04-14 10:12:22.47385+07
69,"PENGARUH MODEL PEMBELAJARAN THINK PAIR SHARE TERHADAP PEMAHAMAN KONSEP MATEMATIS SISWA
( Studi pada Kelas XI Semester Genap SMP Negeri 3 Terbanggi
Besar Tahun Pelajaran 2012/2013)","Herman, AGUSTINA","Penelitian ini adalah penelitian eksperimen semu yang bertujuan untuk mengetahui pengaruh model pembelajaran think pair share terhadap pemahaman konsep matematis siswa. Model pembelajaran think pair share adalah model pembelajaran yang memberi kesempatan kepada siswa agar dapat mengem-bangkan kemampuan siswa secara individu dan kelompok. Desain yang digunakan dalam penelitian ini adalah posttest only control design. Populasi dalam penelitian ini adalah seluruh siswa kelas IX SMP Negeri 3 Terbanggi Besar tahun pelajaran 2013/2014. Sampel penelitian dipilih dua kelas dari delapan kelas dengan cara purposive sampling. Berdasarkan hasil analisis data dengan meng-gunakan uji-t, diperoleh kesimpulan bahwa model pembelajaran think pair share berpengaruh terhadap pemahaman konsep matematis siswa kelas IX SMP Negeri 3 Terbanggi Besar tahun pelajaran 2013/2014.
Kata Kunci : question student have, pemahaman konsep matematis.",2013-12-23,digilib_unila,http://digilib.unila.ac.id/43/1/COVER%20DALAM.pdf,2026-04-14 10:12:22.481583+07
70,ANALISIS PENGARUH PENGELUARAN PEMERINTAH INDONESIA SEKTOR PENDIDIKAN DAN KESEHATAN DALAM APBN TERHADAP KEMISKINAN INDONESIA,"., DERIS DESMAWAN","Kemiskinan adalah masalah yang sangat krusial. Kenyataan ini kiranya menjadi latar belakang mengapa kemiskinan selalu menjadi masalah yang mendapatkan perhatian besar dan mengundang perdebatan, hingga pada level paradgmatik. Oleh karena itu beralasan sekali bila mengatakan bahwa kebudayaan umat manusia dalam setiap zamannya tidak pernah lepas dari orang-orang miskin, mulai dari awal peradaban hingga sekarang ini. Berdasarkan data jumlah penduduk miskin negara-ngara berkembang di Asia  , Indonesia merupakan negara yng termasuk jumlah kemiskinnnya termasuk relatif tinggi. Salah satu cara untuk menanggulangi kemiskinan adalah melalui peningkatan kualitas sumber daya manusia. 

Peningkatan kualitas sumber daya manusia tersebut dibiyai oleh pengeluaran pemerintah daerah pada sektor pendidikan dan kesehatan. Permasalahan dalam penelitian ini adalah seberapa besar pengaruh pengeluaran pemerintah Indonesia sektor pendidikan dan sektor kesehatan terhadap tingkat kemiskinan di Indonsia. Tujuan penelitian ini adalah Untuk mengetahui pengaruh pengeluaran pemerintah Indonesia pada sektor pendidikan terhadap kemiskinan di Indonesia dan Untuk mengetahui pengaruh pengeluaran pemerintah indonesia pada sektor kesehatan terhadap kemiskinan di Indonesia Metode analisis yang digunakan dalam penelitian ini yaitu analisis kuantitatif dengan menggunakan alat analisis regresi linier berganda memakai program Statistical Package the Social Science (SPSS).

Berdasarka perhitungan diperoleh bahwa Pengeluaran pemerintah pada sektor pendidikan berpengaruh nyata terhadap tingkat kemiskinan di Indonesia. Dimana pada saat pengeluaran pemerintah sektor pendidikan dinaikkan sebesar 1% akan mengurangi tingkat kemiskinan sebesar 0,1%. Pengeluaran pemerintah sektor kesehatan berpengaruh nyata terhadap tingkat kesehatan di Indonesia. Dimana pada saat pengeluaran pemerintah sektor kesehatan dinaikkan sebesar 1% akan mengurangi tingkat kemiskinan sebesar 0,1%.
englisah

Poverty is problem very crucial. This fact would be the background of why poverty has always been a big problem to get attention and invite debate, until at level paradgmatik. Therefore very reasonable to say that the culture of mankind in every era is never free from the poor, starting from the beginning of civilization until today. Based on data on the number of poor people in developing countries in Asia-ngara, Indonesia is a country yng including poverty including relatively high amount. One way to tackle poverty is through improving the quality of human resources.

Improving the quality of human resources is dibiyai by local government spending on education and health sectors. The problem in this research is how much influence the Indonesian government expenditure education sector and health sector to the level of poverty in Indonsia. The purpose of this study was to determine the effect of government spending of Indonesia in the education sector on poverty in Indonesia and to know the effect of the Indonesian government expenditure on health sector on poverty in Indonesia method of analysis used in this research is quantitative descriptive analysis by using multiple linear regression analysis using the program Statistical Package Social Science (SPSS).

Based upon the calculation shows that government expenditure on education sector significantly affect the level of poverty in Indonesia. Where in the education sector while government spending increased by 1% would reduce the poverty rate by 0.1%. Health sector government spending significantly affect the level of health in Indonesia. Where at the time of the health sector, government spending increased by 1% would reduce the poverty rate by 0.1%.
",2011-06-19,digilib_unila,http://digilib.unila.ac.id/44/1/COVER.pdf,2026-04-14 10:12:22.48664+07
71,"PENGARUH PENERAPAN MODEL PERAIHAN KONSEP TERHADAP KEMAMPUAN PEMAHAMAN KONSEP MATEMATIKA SISWA
(Studi pada Siswa Kelas VIII Semester Genap SMP Negeri 13 Bandarlampung Tahun Pelajaran 2012/2013)","Sunendar, AHMAT NURDIN","Penelitian eksperimen semu ini bertujuan untuk mengetahui pengaruh model peraihan konsep terhadap pemahaman konsep matematika siswa, dengan desain penelitan postest only control group design. Model peraihan konsep adalah model pembelajaran yang terdiri dari tiga tahapan, yaitu penyajian data dan identifikasi konsep, pengujian pencapaian konsep, dan analisis setrategi berfikir. Populasi penelitian ini adalah seluruh siswa kelas VIII semester genap SMP Negeri 13 Bandarlampung tahun pelajaran 2012/2013. Sampel penelitian adalah siswa kelas VIIIG dan VIIIK yang diambil secara purposive sampling. Data penelitian diperoleh melalui tes. Berdasarkan hasil uji hipotesis, diketahui rata-rata skor pemahaman konsep matematika siswa pada pembelajaran dengan model peraihan konsep lebih tinggi daripada rata-rata skor pemahaman konsep matematika siswa pada pembelajaran dengan model konvensional. Dengan demikian, dapat disimpulkan model peraihan konsep berpengaruh terhadap kemampuan pemahaman konsep matematika siswa.
Kata kunci : Model Peraihan Konsep, Pemahaman Konsep Matematika.",2013-12-23,digilib_unila,http://digilib.unila.ac.id/45/1/2.%20COVER%20DALAM.pdf,2026-04-14 10:12:22.491097+07
73,"PENGARUH PENDEKATAN MATEMATIKA REALISTIK TERHADAP PEMAHAMAN KONSEP MATEMATIKA SISWA
(Studi pada Siswa Kelas VIII SMP Negeri 2 Bandar Lampung)","Bambang, ALBERTUS TYAS GRAHA ADICAHYO","Penelitian ini merupakan penelitian eksperimen semu yang bertujuan untuk mengetahui pengaruh pendekatan matematika realistik terhadap pemahaman konsep matematika siswa. Desain penelitian ini adalah posttest only control group design. Populasi dalam penelitian ini adalah seluruh siswa kelas VIII semester genap SMP Negeri 2 Bandarlampung tahun pelajaran 2012/2013 sebanyak 165 siswa yang terdistribusi dalam enam kelas. Sampel penelitian adalah siswa kelas VIII 2 sebagai kelas kontrol dan siswa kelas VIII 3 sebagai kelas eksperimen yang dipilih dengan teknik purposive random sampling. Berdasarkan hasil analisis data, diperoleh bahwa rata-rata skor pemahaman konsep matematika siswa dengan pendekatan matematika realistik lebih dari pembelajaran konvensional. Dengan demikian, disimpulkan pendekatan matema-tika realistik berpengaruh terhadap pemahaman konsep matematika siswa
Kata kunci : pemahaman konsep matematika, pendekatan matematika realistik, dan pengaruh.",2013-12-23,digilib_unila,http://digilib.unila.ac.id/47/1/COVER%20DALAM.pdf,2026-04-14 10:12:22.503663+07
74," 
PENGUJIAN REAKSI PASAR DALAM MERESPON PENGUMUMAN DIVIDEN MENINGKAT (STUDI EMPIRIS PADA PERUSAHAAN YANG 
TERDAFTAR DI BURSA EFEK INDONESIA) ",".,   DWI HANDAYANI   ","Perusahaan yang membayarkan dividen meningkat dibandingkan tahun lalu mempunyai arti perusahaan berusaha memberikan sinyal yang baik mengenai prospek perusahaan di masa depan. Perubahan pembayaran dividen ini mengandung informasi yang memungkinkan investor merevisi prediksi mereka tentang prospek perusahaan dan akibatnya terjadi penyesuaian harga saham ketika perubahan dividen diumumkan. Penelitian ini bertujuan untuk mengetahui respon investor terhadap pengumuman dividen meningkat.  Penelitian ini menggunakan sampel perusahaan yang terdaftar di Bursa Efek Indonesia dan melakukan pengumuman dividen meningkat pada tahun 2008. Alat analisis yang digunakan adalah SPSS uji non-parametrik Mann-Whitney.  Hasil penelitian pada seluruh sampel menunjukkan bahwa investor tidak bereaksi terhadap pengumuman dividen meningkat baik sebelum maupun sesudah pengumuman. Begitu pula dengan pengumuman dividen meningkat yang diberikan oleh perusahaan bertumbuh. Sedangkan pengumuman dividen meningkat yang diberikan oleh perusahaan tidak bertumbuh menunjukkan adanya perbedaan reaksi investor sebelum dan sesudah adanya pengumuman.  Kata kunci: reaksi pasar, dividen meningkat ",2011-04-16,digilib_unila,http://digilib.unila.ac.id/48/1/COVER%20DEPAN.pdf,2026-04-14 10:12:22.507989+07
75,"ANALISIS KETEPATAN PREDIKSI KEBANGKRUTAN PERUSAHAAN (Perbandingan Antara Model Altman dan ModeL Springate) 
 ","., Erizka Famia Renata "," Penelitian ini bertujuan untuk mengetahui model kebangkrutan yang terbaik 
dengan membandingkan antara The Altman Model dan The Springate Model pada perusahaan yang telah dikeluarkan dari daftar perdagangan saham (delisted) di Bursa Efek Indonesia (BEI) pada tahun 2009.  
Sampel penelitian ini adalah perusahaan yang telah dikeluarkan dari daftar perdagangan saham (delisted)  yang memenuhi kriteria purposive sampling pada penelitian ini. Periode penelitian ini adalah tahun 2007 dan data diolah dengan SPSS 13.0. Alat analisis yang digunakan untuk menguji hipotesis dalam penelitian ini adalah analisis diskriminan dengan menggunakan SPSS 13.0. 
Hasil analisis diskriminan The Altman Model  dan The Springate Model dapat digunakan untuk memprediksi kebangkrutan. Tingkat ketepatan prediksi kebangkrutan pada perusahaan delisted di Bursa Efek Indonesia (BEI) dengan menggunakan model Altman lebih tinggi sebesar 87,5% dibanding dengan model Springate sebesar 81,3%. 
 Keywords: Bankruptcy, Discriminant, Altman, Springate. ",2011-08-10,digilib_unila,http://digilib.unila.ac.id/49/1/Abstrak-Indonesia%20mia.pdf,2026-04-14 10:12:22.51563+07
76,"EFEKTIVITAS MODEL PEMBELAJARAN KOOPERATIF TIPE STAD DITINJAU DARI PEMAHAMAN KONSEP MATEMATIS SISWA
(Studi Pada Siswa Kelas VII SMP Negeri 8 Bandar Lampung Semester Genap Tahun Pelajaran 2012/2013)","Ahmad, YEMI NURTILAWATI","Penelitian eksperimen semu ini bertujuan untuk mengetahui efektivitas model pembelajaran kooperatif tipe STAD ditinjau dari pemahaman konsep matematika siswa. Desain penelitian yang digunakan adalah postest only. Populasi penelitian ini adalah siswa kelas VII SMPN 8 Bandar Lampung, dengan sampel siswa kelas VII-D dan VII-E SMPN 8 Bandar Lampung yang diambil secara purposive random sampling. Data penelitian diperoleh melalui tes pemahaman konsep siswa. Berdasarkan analisis data dengan menggunakan uji-t dan pembahasan diperoleh kesimpulan bahwa model pembelajaran kooperatif tipe STAD efektif ditinjau dari pemahaman konsep metematis siswa kelas VII SMPN 8 Bandar Lampung Semester Genap Tahun Pelajaran 2012/2013.
Kata kunci: STAD, pemahaman konsep matematika siswa",2013-09-23,digilib_unila,http://digilib.unila.ac.id/50/1/COVER%20DALAM.pdf,2026-04-14 10:12:22.520151+07
82,"PENGARUH MODEL PEMBELAJARAN KOOPERATIF TIPE GROUP INVESTIGATION TERHADAP KEMAMPUAN KOMUNIKASI MATEMATIS SISWA
(Studi Pada Siswa Kelas VIII Semester Genap SMP Negeri 2 Pringsewu Tahun Pelajaran 2012/2013)","Usman, Fatma Niati Solekha","Penelitian eksperimen semu ini bertujuan untuk mengetahui pengaruh model pembelajaran kooperatif tipe Group Investigation terhadap kemampuan komunikasi matematis siswa. Desain penelitian yang digunakan adalah posttest only control group design. Populasi dalam penelitian ini adalah seluruh siswa kelas VIII SMP Negeri 2 Pringsewu, sedangkan sampel penelitian adalah siswa kelas VIIIB dan VIIIC yang diperoleh dengan cara memilih dua kelas dari sembilan kelas secara purposive sampling yaitu dengan mengambil dua kelas yang diajar oleh guru matematika yang sama dan memiliki kemampuan rata-rata yang relatif sama. Berdasarkan pengujian hipotesis diperoleh bahwa kemampuan komunikasi matematis siswa yang mengikuti pembelajaran dengan model Group Investigation lebih tinggi dari pada siswa yang mengikuti pembelajaran konvensional. Kesimpulan dari penelitian ini adalah model pembelajaran tipe Group Investigation berpengaruh terhadap kemampuan komunikasi siswa.
Kata Kunci : Group Investigation, Komunikasi Matematis.",2013-12-23,digilib_unila,http://digilib.unila.ac.id/56/1/COVER%20DALAM.pdf,2026-04-14 10:12:22.556169+07
