1,"Praktik Manajemen CSR (tanggung jawab sosial perusahaan) 
PT. GGPC Lampung Tengah
"," Wildan, Abdurrahman Wildan",,,digilib,oai:digilib.unila.ac.id:4,2026-04-14 05:54:45.603496+07
2," 
OPTIMASI ALIRAN DAYA MENGGUNAKAN UNIFIED POWER FLOW CONTROL (UPFC) PADA SISTEM TRANSMISI 150 KV WILAYAH 
 
LAMPUNG ","., EZI HAILI ANANTA ",,,digilib,oai:digilib.unila.ac.id:8,2026-04-14 05:54:45.778724+07
3,KETAHANAN KULTIVAR CABAI MERAH (Capsicum annuum L.) TERHADAP JAMUR Colletotrichum capsici (Syd.) Butler & Bisby PENYEBAB PENYAKIT ANTRAKNOSA,"Miskun, Arie Regita",,,digilib,oai:digilib.unila.ac.id:9,2026-04-14 05:54:45.80819+07
4,"STUDI DAYA DUKUNG TANAH ORGANIK  MENGGUNAKAN MATOS 
 ","., M. SENDI WIRATAMA ",,,digilib,oai:digilib.unila.ac.id:10,2026-04-14 05:54:45.864758+07
5,"PERANCANGAN DAN IMPLEMENTASI SISTEM INFORMASI RESTORAN MULTI CABANG 
MANAJEMEN TERPUSAT DENGAN MENGGUNAKAN VPN (VIRTUAL PRIVATE NETWORK) 
 (Studi Kasus di Pondok Santap Glompong) ","., RENDI AGUNG WIJAYA ",,,digilib,oai:digilib.unila.ac.id:11,2026-04-14 05:54:45.923972+07
6,"RANCANG BANGUN KONVEYOR PENYORTIRAN BARANG DENGAN PENGENALAN POLA BENTUK DAN WARNA MENGGUNAKAN 
WE B C A M  ","., Rudi Hasudungan Hutabarat ",,,digilib,oai:digilib.unila.ac.id:12,2026-04-14 05:54:45.965286+07
7,RANCANG BANGUN PENGATURAN PAKAN PADA MODEL TAMBAK SECARA OTOMATIS BERBASIS MIKROKONTROLLER ATMEGA32 ,"., SINGGIH ANDRIYAWAN ",,,digilib,oai:digilib.unila.ac.id:13,2026-04-14 05:54:46.004186+07
8,"RANCANG BANGUN SISTEM PAKAR UNTUK MENDIAGNOSA PENYAKIT TANAMAN CABAI 
DENGAN METODE FORWARD CHAINING  ","., Anas Anshori ",,,digilib,oai:digilib.unila.ac.id:14,2026-04-14 05:54:46.017235+07
9,ANALISA PENTANAHAN NETRAL PADA GARDU INDUK 150 kV PADA SISTEM INTERKONEKSI SUMBAGSEL,"., FARDINAN AHMAD",,,digilib,oai:digilib.unila.ac.id:15,2026-04-14 05:54:46.031559+07
10,RANCANG BANGUN SIMULATOR ALAT BANTU KESELAMATAN TERPADU PADA KENDARAAN BERDASARKAN SENSOR JARAK DENGAN MENGGUNAKAN MIKROKONTROLER ATMEGA8535 ,"., RIYO HARDIYANTO ",,,digilib,oai:digilib.unila.ac.id:16,2026-04-14 05:54:46.036775+07
18,Pengaruh Citra Merek dan Kesadaran Merek Terhadap Keputusan Pembelian Produk Skintific Pada TikTokshop (Studi Kasus Mahasiswa FEB Universitas Bandar Lampung),"Agnes Nofita Fatmasari, M. S. Barusman","Studi ini menganalisis pengaruh citra merek dan kesadaran merek terhadap keputusan pembelian produk skincare Skintific melalui Tikok Shop, pada mahasiswa FEB Universitas Bandar Lampung. Metodologi menggunakan teknik kuantitatif yang dilakukan dengan analisis regresi linier berganda. Data telah dikumpulkan dari sembilan puluh responden yang merupakan pengguna aktif TikTok. Temuan didapat citra merek memiliki kontribusi signifikan pada keputusan pembelian. Demikian pula, kesadaran merek berpengaru",,semantic_scholar,https://www.semanticscholar.org/paper/b34dd09ddfbe8e9e41cc6740982ab0563c162fac,2026-04-14 09:40:41.280665+07
19,Pengaruh Influencer TikTok Awbimax Terhadap Penilaian Sosial Mahasiswa Universitas Lampung,"Imam Mahmud, Arif Ainun Na’im, Erna Wahyu Septianna","Penelitian ini bertujuan untuk menginvestigasi pengaruh influencer TikTok dengan nama akun @Awbimax terhadap penilaian sosial mahasiswa Universitas Lampung. Dalam era media sosial, influencer memiliki peran penting dalam menyebarkan informasi dan memengaruhi perilaku masyarakat, termasuk di antaranya mahasiswa. Penelitian ini dilatarbelakangi oleh fenomena kritik yang dilontarkan oleh Awbimax terhadap kondisi di Provinsi Lampung, yang menciptakan respon dan tanggapan dari masyarakat, termasuk ma",,semantic_scholar,https://www.semanticscholar.org/paper/e3b5f1dea94cd35345e4e505baa4a11adb986b0d,2026-04-14 09:40:41.348159+07
20,Analisis Implementasi Pengendalian Waktu Dan Biaya Pada Pelaksanaan Pembangunan Gedung C Fkip Tahap III Universitas Lampung Dengan Metode Earned Value,"Ike Novita Sari, I. Kustiani, Amril Ma''ruf Siregar","Sarana dan prasarana menjadi penunjang utama dalam meningkatkan pendidikan di Indonesia. Universitas Lampung melakukan kegiatan rutin yakni pembangunan maupun renovasi gedung-gedung guna menunjang kebutuhan fasilitas pendidikan. Agar kegiatan proyek pembangunan berjalan sesuai jadwal dan sesuai anggaran, maka diperlukan pengendalian proyek seperti pada pembangunan Gedung C FKIP Tahap 3 Universitas Lampung dilakukan dengan menggunakan metode nilai hasil. Tujuan dari penelitian ini adalah menganal",,semantic_scholar,https://www.semanticscholar.org/paper/a4827ce7564e771f57032d26b14caece2538f525,2026-04-14 09:40:41.358046+07
21,Pengaruh Efikasi Diri Terhadap Kemampuan Menulis Karya Tulis Ilmiah Pada Mahasiswa PPKn FKIP Universitas Lampung,"Putri Retno Sari, Yunisca Nurmalisa, S. Susilo, Berchah Pitoewas, N. Nurhayati","Keyakinan akan kemampuan diri (efikasi diri) yang baik dalam menulis karya ilmiah membuat mahasiswa yakin akan mampu menghasilkan karya ilmiah yang baik dan berkualitas. Hal ini karena efikasi diri dapat memengaruhi motivasi, usaha, dan ketekunan dalam melakukan penelitian yang mendalam, mengumpulkan data yang relevan, dan menyusun argumen yang kuat. Penelitian ini memiliki tujuan untuk meneliti pengaruh efikasi diri terhadap kemampuan menulis karya ilmiah pada mahasiswa PPKn Universitas Lampung",,semantic_scholar,https://www.semanticscholar.org/paper/1c3d49f229652e07b7ba0cb699fe81199cedb4fc,2026-04-14 09:40:41.366465+07
22,Strategi Networking Berbasis Ilmu Komunikasi: Upaya Mahasiswa KKN Universitas Lampung dalam Mempromosikan Wisata Desa Kecapi,"E. Ermawati, Defitriani, Tetri Ayu Nabila, Rehulina Girsang, Niki Nabila Utami, Evandra Athallah Pramana, Muammar Haikal Azzahran, Munti Sarida","Permasalahan utama yang dihadapi oleh wisata desa kecapi adalah minimnya pengetahuan dalam pemanfaatan public speaking untuk memasarkan wisata belerang simpur di sosial media. Meski demikian, pengelola wisata belerang simpur dan karang taruna menunjukan minat dalam bidang Social Media Marketing (SMM). oleh karena itu, Mahasiswa/i KKN Universitas Lampung Desa Kecapi melaksanakan program kerja yang berjudul Strategi Networking Berbasis Ilmu Komunikasi. Program ini dilaksanakan pada 27 Januari 2025",,semantic_scholar,https://www.semanticscholar.org/paper/03830781b6c44a58cf2871d8fdb28bd56eddaf07,2026-04-14 09:40:41.381936+07
23,Filter Bubble dan Echo Chamber: Pengaruh Algoritma Media Sosial terhadap Pola Konsumsi Informasi Mahasiswa Universitas Lampung,"Dean Mulya Armanda, Dzakia Afaf, Restu Krisdahyanto","Perkembangan pesat teknologi informasi, terutama di media sosial, telah mengubah cara kita mengakses dan menyebarkan informasi. Di balik kemudahan tersebut, muncul fenomena filter bubble dan echo chamber, yang semakin relevan dengan kehidupan digital saat ini. Filter bubble mengacu pada kecenderungan algoritma media sosial yang hanya menampilkan informasi sesuai dengan preferensi dan pandangan kita, sementara echo chamber menggambarkan kondisi di mana kita hanya dikelilingi oleh informasi yang m",,semantic_scholar,https://www.semanticscholar.org/paper/00b0b41bf4563ce5523f457d8f7387cc5d934dcf,2026-04-14 09:40:41.387954+07
24,Pengaruh Self Development Terhadap Keterampilan Berkomunikasi Mahasiswa PPKn Universitas Lampung,"Elsa Nurhalisa, Berchah Pitoewas, D. Putri",Penelitian ini bertujuan untuk mengetahui bagaimana pengaruh Self Development terhadap Keterampilan Berkomunikasi Mahasiswa PPKn Universitas Lampung. Metode yang digunakan adalah deskriptif dengan pendekatan kuantitatif. Subjek dalam penelitian ini adalah mahasiswa PPKn Universitas Lampung dengan sampel 164 responden. Teknik pokok pengumpulan data menggunakan angket serta data pendukung observasi dan wawancara. Hasil penelitian menunujukkan bahwa terdapat pengaruh self development terhadap keter,,semantic_scholar,https://www.semanticscholar.org/paper/bdc6418c2a8832152810ecb3914ce7aeae8e20db,2026-04-14 09:40:41.39821+07
25,PENGARUH INFLUENCER DAN CONTENT MARKETING TERHADAP KEPUTUSAN PEMBELIAN DI TIKTOK PADA GENERASI Z DI BANDAR LAMPUNG (STUDI PADA MAHASISWA AKTIF ANGKATAN 2021 FAKULTAS EKONOMI DAN BISNIS UNIVERSITAS BANDAR LAMPUNG),"Ardansyah, Marlinda","Dalam era digital, media sosial terutama TikTok, menjadi platform utama bagi Generasi Z untuk berinteraksi dan membuat keputusan pembelian. Bertujuan untuk mengevaluasi keputusan pembelian di TikTok pada Generasi Z di Bandar Lampung dipengaruhi oleh influencer dan content marketing. Metode kuantitatif yang diimplementasikan pada penelitian ini dengan populasi sejumlah 272 mahasiswa dan sampel melibatkan (73) Responden yang dipilih secara acak dan ditentukan secara spesifik menggunakan rumus Slov",,semantic_scholar,https://www.semanticscholar.org/paper/aa93784f0296f1468b6b79d28ef5671ee7d4b82e,2026-04-14 09:40:41.405421+07
26,Pengaruh Kualitas Produk dan Harga Terhadap Keputusan Pembelian Indomie Mahasiswa Universitas Bandar Lampung,"Arya Auralio Joyo, H. G. Soedarsa","Penelitian ini bertujuan untuk mengetahui pengaruh antara Kualitas Produk dan Harga Terhadap Keputusan Pembelian Indomie Mahasiswa Universitas Bandar Lampung. Penelitian ini menggunakan pendekatan kuantitatif dengan alat analisis SPSS. Uji kualitas data yang digunakan yaitu uji validitas dan uji reliabilitas, selanjutnya dilakukan uji asumsi klasik yaitu uji normalitas, uji multikolinearitas, dan uji heteroskedastisitas. Kemudian, pengujian hipotesis yang dilakukan yaitu uji t, selanjutnya dilak",,semantic_scholar,https://www.semanticscholar.org/paper/92468420c9f37a35076276e8e388401f6565c065,2026-04-14 09:40:41.410477+07
27,"Perencanaan Tempat Pengolahan Sampah Berbasis 3R (Reduce, Reuse, Recycle) Di Universitas Malahayati Bandar Lampung",Ananda Restu Abadi,"Tempat pengolahan sampah berbasis 3R (TPS 3R) merupakan lokasi di mana dilakukan kegiatan pengumpulan, pemilahan, penggunaan kembali, dan daur ulang sampah yang dirancang untuk membantu mengolah sampah dalam skala kawasan. Penelitian ini bertujuan untuk mengetahui bagaimana desain perencanaan Tempat Pengolahan Sampah (TPS) berbasis 3R (Reuse, Reduce, Recycle) di Universitas Malahayati Bandar Lampung. Metode penelitian yang digunakan yaitu SNI 19-3694-1994 mengenai metode pengambilan dan pengukur",,semantic_scholar,https://www.semanticscholar.org/paper/68ad363693ae0383370a2566ee912c7927dcb326,2026-04-14 09:40:41.414521+07
28,Analisis Tingkat Pemahaman Mahasiswa Teknik Elektro Terhadap Materi Semikonduktor untuk Memenuhi Kebutuhan Industri: Studi Kasus di Universitas Lampung,"Sri Purwiyanti, Helm Fitriawan, M. Komarudin, Syaiful Alam","The semiconductor industry is a strategic sector that plays a crucial role in supporting digital transformation and national technological independence. To build a competitive semiconductor ecosystem, it is essential to develop human resources (HR) with a strong understanding of semiconductor concepts and applications. This study aims to analyze the level of understanding among electrical engineering students regarding semiconductor materials as a foundation for strengthening HR capacity in this",,semantic_scholar,https://www.semanticscholar.org/paper/33a60e95c7c45f74a86c21a85925c77ee0b9c6fd,2026-04-14 09:40:41.418626+07
29,Pengaruh Pembelajaran Kewirausahaan dan Motivasi Berwirausaha Terhadap Minat Berwirausaha Pada Mahasiswa Fakultas Ekonomi dan Bisnis Universitas Bandar Lampung,"Dhalvi Al Affan, Harpain","Indonesia is currently facing a demographic bonus with the majority of its population being of productive age, which provides a great opportunity to increase economic productivity through entrepreneurship. Bandar Lampung University supports this through various entrepreneurship programs, such as the Innovation and Ideavation Academy. The study aims to examine the impact. The study explores the impact of entrepreneurial education and motivational factors on students'' entrepreneurial interest at t",,semantic_scholar,https://www.semanticscholar.org/paper/15cc8d0ef564afc8ec4f0b83e0609f299dc95030,2026-04-14 09:40:41.424772+07
30,IMPLEMENTASI WAZUH MENGGUNAKAN METODE PPDIOO DI SISTEM KEAMANAN JARINGAN PSDKU UNIVERSITAS LAMPUNG WAYKANAN SEBAGAI DETEKSI DAN RESPON SERANGAN SIBER,"Azzah Shafiyyah, Gigih Forda Nama, Rio Ariestia Pradipta","PSDKU Universitas Lampung Way Kanan membutuhkan sistem keamanan jaringan yang efektif untuk melindungi jaringan komputer server lab komputer dari serangan siber yaitu brute force dan Denial of Service (DoS)Untuk meningkatkan keamanan jaringan, diperlukan implementasi sistem keamanan jaringan dengan menggunakan platform wazuh sebagai server monitoring dan wazuh agent yang diinstal pada komputer server jaringan lab komputer PSDKU menggunakan Server Utama PSDKU. Metodepengembangan sistem keamanan y",,semantic_scholar,https://www.semanticscholar.org/paper/7c4424ab641676fde5c4af4251f31c64ef9fbb68,2026-04-14 09:40:41.430124+07
31,HUBUNGAN AKTIVITAS FISIK TERHADAP FLEKSIBILITAS LUMBAL PADA MAHASISWA FAKULTAS KEDOKTERAN UNIVERSITAS LAMPUNG,"Hafshah Hafshah, D. N. Fiana, Ratna Dewi Puspita Sari",Mahasiswa kedokteran cenderung memiliki tingkat aktivitas fisik yang ringan. Penurunan tingkat aktivitas fisik dapat memengaruhi fleksibilitas. Gaya hidup yang cenderung kurang aktif akan menimbulkan terjadinya kekakuan pada otot atau jaringan ikat pada sendinya. Hal ini disebabkan oleh adanya pemendekan atau atrofi otot karena otot tersebut kurang aktif digunakan. Penelitian ini bertujuan untuk mengetahui hubungan antara tingkat aktivitas fisik terhadap fleksibilitas lumbal. Penelitian cross se,,semantic_scholar,https://www.semanticscholar.org/paper/445de0373988d93a8d4bce065cdd908b35e9b907,2026-04-14 09:40:41.434398+07
32,EVALUASI KUALITAS SITUS WEB VIRTUAL CLASS UNIVERSITAS LAMPUNG MENGGUNAKAN METODE WEBQUAL 4.0: STUDI KASUS MAHASISWA FAKULTAS TEKNIK UNIVERSITAS LAMPUNG,Beltra Saura Rahmadan,"Virtual Class Universitas Lampung (VClass Unila) merupakan platform belajar dari yang dikembangkan Universitas Lampung. Selama pengimplentasian VClass Unila belum pernah dilakukan evaluasi untuk mengukur tingkat kepuasan mahasiswa terhadap website VClass Unila. Hal tersebut berpotensi menyebabkan sejumlah dampak negatif, seperti tidak terdeteksinya masalah yang mungkin dialami mahasiswa saat menggunakan website. Untuk menanggulangi masalah tersebut perlu dilakukan evaluasi terhadap kualitas webs",,semantic_scholar,https://www.semanticscholar.org/paper/6dbcb87b2083b68eacc6e5db7e41d73b1477afab,2026-04-14 09:40:41.441628+07
33,PENGARUH BEBAN KERJA DAN PENGEMBANGAN KARIR TERHADAP KINERJA SUMBER DAYA MANUSIA PADA FAKULTAS HUKUM UNIVERSITAS LAMPUNG,M. Roni,"Tujuan penelitian ini adalah untuk mengetahui seberapa besar pengaruh beban kerja dan pengembangan karir terhadap kinerja sumber daya manusia (SDM) pada Fakultas Hukum Universitas Lampung. Dalam penelitian ini menggunakan pendekatan deskriptif kuantitatif, dimana pengolahan datanya dilakukan secara statistik. Jumlah sampel yang diambil adalah sebanyak 65 responden dengan metode Sampling Jenuh, kelompok dari Non Probability Sampling, yaitu dilakukan secara sensus dimana populasi dijadikan sampel ",,semantic_scholar,https://www.semanticscholar.org/paper/50cab63afbbf8f70f8d7542a217f671ae3789f97,2026-04-14 09:40:41.446873+07
34,Pelatihan Penerapan Konsep Keuangan bagi Kepengurusan Koperasi Mahasiswa (KOPMA) Universitas Lampung,"Mohammad athian Manan, Euis Mufahamah, Ayu Nursari, Hiro Sejati","This community service program was conducted at the Student Cooperative of Lampung University (Kopma Unila) with the aim of enhancing the financial literacy of its board members. The program involved 60 Kopma Unila board members and included education on financial management, the culture of saving, and investment. The methods used consisted of material presentations, interactive discussions, and hands-on practice. The results of this activity showed a significant increase in the understanding an",,semantic_scholar,https://www.semanticscholar.org/paper/1300e290620a2f87116cd2674f6fb85d34cad5ab,2026-04-14 09:40:41.450774+07
35,Hubungan Aktifitas Fisik Dengan Tekanan Darah Pada Karyawan Di Universitas Malahayati Bandar Lampung,"Muhamad Afgan Triana, Ringgo Alfarisi, Selvia Anggraeni, Teddy Teddy","Tingkat prevalensi hipertensi di provinsi Lampung, yang berada pada angka 29,94%, menempatkannya di peringkat 16 di antara provinsi-provinsi lainnya. Hipertensi telah dikaitkan dengan berbagai faktor risiko, termasuk kurangnya aktivitas fisik. Aktivitas fisik dapat mengurangi risiko hipertensi melalui beberapa mekanisme, termasuk adanya resistensi dalam pembuluh darah, gangguan regulasi fungsi sistem saraf simpatik, dan adanya sistem renin-angiotensin.     Tujuan penelitian ini adalah untuk meng",,semantic_scholar,https://www.semanticscholar.org/paper/8304e0924e8a645ca8afddc613864ae799f30aec,2026-04-14 09:40:41.454985+07
36,Studi Perilaku Harian Rusa Timor (Cervus timorensis) Di Penangkaran Rusa Universitas Lampung,"Bainah Sari Dewi, S. Nurjanah, Dian Iswandaru, S. Harianto","University of Lampung is one of the institutions that support the conservation of timor deer (Cervus timorensis) through ex-situ conservation in the form of captivity. In an effort to develop timor deer in captivity, it is necessary to know the daily behavior data. The purpose of this study was to determine the daily behavior of timor deer in deer breeding at Lampung University. This research was conducted for 10 days in October-November 2023, starting at 06.00-18.00 WIB. The method used was the",,semantic_scholar,https://www.semanticscholar.org/paper/beba111fa2f8e667129477fa13c25d26f141c378,2026-04-14 09:40:41.458598+07
37,Peran Biro Kemahasiswaan Dan Alumni (Bimawa) Universitas Muhammadiyah Lampung Dalam Pengembangan Potensi Non Akademik Mahasiswa,"M. F. Ramadan, N. Islam, M. Putri","Penelitian ini bertujuan untuk mengeksplorasi peranan Biro Kemahasiswaan dan Alumni (Bimawa) Universitas Muhammadiyah Lampung dalam pengembangan potensi non akademik mahasiswa, khususnya bagi mahasiswa Prodi Ilmu Pemerintahan FISIP angkatan 2021. Metode yang digunakan dalam penelitian ini meliputi wawancara semi-terstruktur, observasi partisipan, dan analisis dokumen. Melalui wawancara dengan berbagai informan, peneliti mengumpulkan data mengenai program-program yang diselenggarakan oleh Bimawa ",,semantic_scholar,https://www.semanticscholar.org/paper/95487d1fb381fb8dcfb98051c8b3bbd36fda5b64,2026-04-14 09:40:41.465948+07
39," 
OPTIMASI ALIRAN DAYA MENGGUNAKAN UNIFIED POWER FLOW CONTROL (UPFC) PADA SISTEM TRANSMISI 150 KV WILAYAH 
 
LAMPUNG ","., EZI HAILI ANANTA ","Jaringan transmisi merupakan bagian penting dalam sistem tenaga untuk 
menyalurkan energi listrik dari pusat pembangkit ke beban, untuk itu sistem tenaga harus diusahakan secara maksimal agar dicapai aliran daya yang optimal, artinya dengan tercapainya syarat – syarat tegangan yang terpenuhi dan rugi – rugi daya yang minimal. 
Pada penelitian ini akan dilakukan simulasi tentang optimasi aliran daya menggunakan Unified Power Flow Control ( UPFC ). UPFC dapat mengontrol aliran daya pada transmisi dengan  mengatur parameter yang mempengaruhi aliran daya sehingga dicapai aliran daya yang optimal. 
Dari hasil penelitian diperoleh bahwa pemasangan UPFC untuk menghasilkan aliran daya optimal berada antara bus 3 (Bukit Kemuning) dengan bus 4 (Kotabumi) dengan injeksi tegangan r sebesar 0.1 p.u. sudut 300° (deg) diperoleh penurunan total loss saluran sebesar 49.33 % daya aktif  dan 49.20 % daya reaktif dan peningkatan tegangan pada bus 4 sebesar 2.66 %. 
 Kata kunci : FACT, UPFC, Aliran Daya, Optimasi Aliran Daya ",2013-02-18,digilib_unila,http://digilib.unila.ac.id/8/1/cover%20dalam.pdf,2026-04-14 10:12:22.095301+07
40,KETAHANAN KULTIVAR CABAI MERAH (Capsicum annuum L.) TERHADAP JAMUR Colletotrichum capsici (Syd.) Butler & Bisby PENYEBAB PENYAKIT ANTRAKNOSA,"Miskun, Arie Regita","Cabai merah (Capsicum annuum L.) merupakan komoditas sayuran yang memiliki nilai ekonomis cukup tinggi dan sangat digemari karena memiliki rasa yang pedas dan dapat merangsang selera makan. Penyakit yang sering menyerang tanaman cabai adalah penyakit antraknosa (patek) yang disebabkan oleh jamur Colletotrichum capsici. Biasanya jamur ini menyerang daun tanaman cabai, namun pada tahap serius dapat menyerang buah cabai. Penggunaan kultivar-kultivar yang tahan (resisten) dengan daya hasil yang tinggi merupakan syarat mutlak untuk mendapatkan produksi tanaman yang menguntungkan secara ekonomis. Tujuan dari penelitian ini adalah untuk memperoleh kultivar cabai merah yang tahan terhadap jamur Colletotrichum capsici penyebab penyakit antranoksa.
Penelitian dilakukan dari bulan Agustus 2012 – Januari 2013 di Laboratorium Botani FMIPA Universitas Lampung. Penelitian menggunakan Rancangan Acak Lengkap (RAL) dengan perlakuan yaitu 4 kultivar cabai dengan ulangan sebanyak 6 kali. Parameter yang digunakan adalah Awal Munculnya Gejala (hari), Intensitas Serangan(%) dan tinggi tanaman (cm). Hasil penelitian dilakukan analisis ragam, apabila terjadi perbedaan nyata maka dilanjutkan dengan uji Beda Nyata Terkecil (BNT) pada taraf 5%.
Hasil analisis data pada α:5% menunjukkan bahwa kultivar cabai merah Cakra (C2) memiliki ketahanan yang lebih tinggi terhadap serangan jamur C. capsici dibandingkan kultivar cabai merah lainnya.

Kata Kunci: Antraknosa, Capsicum annuum, Colletotrichum capsici",2013-12-23,digilib_unila,http://digilib.unila.ac.id/9/1/COVER%20DALAM.pdf,2026-04-14 10:12:22.113166+07
41,"STUDI DAYA DUKUNG TANAH ORGANIK  MENGGUNAKAN MATOS 
 ","., M. SENDI WIRATAMA ","Tanah yang digunakan sebagai subgrade harus memiliki daya dukung yang mampu menahan beban  diatasnya. Kondisi tanah pada suatu daerah tidak akan memiliki sifat tanah yang sama dengan daerah lainnya. Ada yang mempunyai daya dukung baik dan adapula yang sangat buruk. Stabilisasi tanah merupakan salah satu alternatif yang bisa digunakan untuk memperbaiki daya dukung tanah.  Sampel tanah yang di uji pada penelitian ini yaitu tanah organik yang berasal dari Rawa Seragi, Kabupaten Lampung Timur – Provinsi Lampung. Tanah ini memiliki nilai CBR ≤ 6 % sehingga untuk dapat digunakan sebagai lapisan subgrade maka tanah harus distabilisasi. Sedangkan bahan additive yang digunakan sebagai bahan pencampurnya adalah Matos. Kadar larutan Matos yang digunakan yaitu 5,217 gram plus semen sebanyak 0.12 kg, 0,30 kg, dan 0,48kg untuk 6 kg sampel tanah dengan waktu pemeraman 7 hari dan rendaman 4 hari.  Hasil penelitian di laboratorium menunjukkan bahwa bahan stabilisasi menggunakan Matos dapat memperbaiki sifat fisik dan mekanik tanah organik. Hasil dari pengujian CBR pemeraman 7 hari dan rendaman 4 hari tanah yang telah distabilisasi dengan campuran Matos dapat digunakan sebagai tanah dasar pada konstruksi jalan dikarenakan nilai CBRnya ≥ 6 % (Standar Bina Marga).  Kata kunci : Matos, Stabilisasi Tanah, Tanah Organik, CBR. 
 ",2013-04-08,digilib_unila,http://digilib.unila.ac.id/10/1/1.COVER.pdf,2026-04-14 10:12:22.13054+07
42,"PERANCANGAN DAN IMPLEMENTASI SISTEM INFORMASI RESTORAN MULTI CABANG 
MANAJEMEN TERPUSAT DENGAN MENGGUNAKAN VPN (VIRTUAL PRIVATE NETWORK) 
 (Studi Kasus di Pondok Santap Glompong) ","., RENDI AGUNG WIJAYA ","Perkembangan restoran multi cabang yang semakin pesat namun pengelolaan informasi masih secara manual dapat memunculkan masalah seperti kesulitan memantau kondisi bahan baku dan keuangan dari masing-masing cabang menjadi seperti yang terjadi di Pondok Santap Glompong. Sistem informasi multi cabang diperlukan untuk membantu pengelolaan dan pemantauan kegiatan restoran melalui jaringan internet secara terpusat.  Pengembangan sistem ini menggunakan modified waterfall model dengan alat bantu Lazarus Pascal IDE, PHP & JQuery Mobile, MySQL Server dan LogMeIn Hamachi VPN Software. Sistem dikembangkan berdasarkan kebutuhan calon pengguna dalam hal ini adalah Pondok Santap Glompong.  Perancangan dan implementasi yang dilakukan telah menghasilkan sebuah sistem informasi restoran yang memiliki fasilitas seperti pengelolaan bahan baku, menu, pesanan berbasis mobile, transaksi, laporan dan sinkronisasi secara online dengan bantuan software VPN LogMeIn Hamachi. Sistem ini mampu memenuhi kebutuhan pengguna. Selain itu, koneksi VPN yang dibangun dapat mempermudah proses sinkronisasi data, manajemen cabang dan pemantauan secara online tanpa memerlukan konfigurasi server VPN khusus.   Kata Kunci: sistem informasi restoran multi cabang, metode modified waterfall. 
 ",2013-03-17,digilib_unila,http://digilib.unila.ac.id/11/1/COVER%20DALAM.pdf,2026-04-14 10:12:22.158669+07
44,RANCANG BANGUN PENGATURAN PAKAN PADA MODEL TAMBAK SECARA OTOMATIS BERBASIS MIKROKONTROLLER ATMEGA32 ,"., SINGGIH ANDRIYAWAN ","Dalam penelitian tugas akhir ini dirancang sebuah alat pemberian pakan ya
dapat bekerja secara otomatis berbasis mikrokontroller ATmega32 yang nantindiharapkan dapat meringankan pekerjaan manusia khususnya bagi pemilik tambaatau petani budidaya ikan yang dapat menghemat waktu dalam pengerjaannya. Rancang bangun alat pemberian pakan secara otomatis ini menggunakamikrokontroller ATmega32 sebagai pengendali utamanya yang berfungsi untuk mengatur beberapa komponen yang terdapat pada alat ini seperti rangkaswitching dan penampil LCD. Selain itu mikrokontroller ATmega32 juga berfungsi membaca nilai ADC yang diberikan oleh sensor tahanan gesRangkaian switching digunakan sebagai pemicu untuk menjalankan motor AC dan motor DC sedangkan LCD digunakan untuk menampilkan pembacaan nilADC pada sensor.  Kata Kunci : Pemberian pakan otomatis, Mikrokontroller ATmega32, Rangkaia
 
Switching dan LCD ",2013-04-06,digilib_unila,http://digilib.unila.ac.id/13/1/Cover%20Dalam.pdf,2026-04-14 10:12:22.229259+07
