100,PERAN DINAS PERTAMBANGAN DAN ENERGI KABUPATEN LAMPUNG SELATAN DALAM MENANGANI KEGIATAN PERTAMBANGAN TANPA IZIN ( PETI ),"., ADRIAN NUGRAHA","Indonesia merupakan negara yang kaya akan sumber daya alam  (SDA) yang tidak terlepas dari pertumbuhan pembangunan yang berkelanjutan. Pertumbuhan ekonomi yang cukup tinggi diperlukan untuk menggerakkan dan memacu pembangunan dibidang-bidang lain sekaligus sebagai kekuatan utama pembangunan untuk mewujudkan pemerataan pembangunan dan hasil-hasilnya dengan lebih baik untuk berperan aktif dalam pembangunan nasional.Berdasarkan Undang-undang Nomor 4 Tahun 2009 Tentang Pokok-pokok Pertambangan setiap Usaha Pertambangan haurs memiliki Izin dari Kepala Daerah setemapat melalui Dinas Pertambangan dan Energi Kabupaten Lampung Selatan yang berguna untuk menambah Pendapatan Asli Daerah             ( PAD ).     
Pertambangan merupakan industri tertua kedua setelah pertanian. Proyek-proyek industri pertambangan diharapkan dapat menjadi kutub pertumbuhan atau growth pole bagi daerah sekitarnya. Dampak positif dari bertambahnya jumlah perusahaan yang bergerak dan menanamkan investasinya di bidang pertambangan dapat meningkatkan devisa negara dan pendapatan asli daerah, menampung tenaga kerja, dan lain-lain. Dari aspek devisa negara dan pendapatan asli daerah keberadaan perusahaan tambang sangat membantu dalam pembangunan nasional dan daerah. Begitu juga dalam menyerap tenaga kerja baik tenaga kerja lokal, regional, nasional maupun internasional.

Pertambangan Tanpa Izin  adalah usaha pertambangan yang dilakukan oleh perseorangan, sekelompok orang, atau perusahaan/yayasan ber¬badan hukum yang dalam operasinya tidak memilki izin dari instansi pemerintah sesuai peraturan perundang-undangan yang berlaku. Dengan demikian, izin, rekomendasi , atau bentuk apapun yang diberikan kepada perseorangan, sekelompok orang, atau perusahaan/yayasan oleh instansi pemerintah di luar ketentuan peraturan perundang¬-undangan yang berlaku, dapat dikategorikan sebagai PETI.
Permasalahan dalam penelitian ini adalah : (1) Bagaimana Peran Dinas Petambangan dan Energi Kabupaten Lampung Selatan Dalam Menangani Kegiatan Pertambangan Tanpa Izin ( PETI ) . (2) Faktor apa saja kah yang menghambat Dinas Petambangan dan Energi Kabupaten Lampung Selatan. (3) Sanksi Hukum bagi para pengusaha Tambang di Kabupaten Lampung Selatan yang tidak memiliki Izin Tambang.
Peran Dinas Pertambangan dan Energi dalam menangani kegiatan Pertambangan Tanpa izin adalah Dinas Petambangan dan Energi melakukan Sosialisasi, Pendataan, Penertiban dan Pengawasan terhadap semua perusahaan yang bergerak dibidang pertambangan setelah mendapatkan data maka akan dilihat mana yang memiliki izin usaha petambangan dan mana yang tidak memiliki izin . setiap usaha pertambangan harus memiliki izin maka setiap usaha pertambangan yang tidak memiliki izin ( PETI ) akan dibina untuk segera melakukan perizinan kepada Dinas Pertambangan dan Energi.

faktor penghambat Dinas Pertambangan dan Energi Kabupaten Lampung Selatan Dalam menangani Kegiatan Pertambangan Tanpa Izin adalah Tim Teknis dari Dinas Pertambangan dan Energi Kabupaten Lampung Selatan tidak menjalankan tugas sebagaimana mestinya,mungkin ada petugas yang memberikan  kemudahan ,menutupi atau melindungi Perusahaan yang bergerak dibidang Pertambangan yang belum Memiliki Surat Izin Usaha Tambang ( SIUP ), sehingga masih banyak Pertambangan Tanpa Izin Yang Terdapat di Kabupaten Lampung Selatan.

Sosialisasi akan pentingnya Perizinan yang berguna untuk mengetahui layak atau tidaknya alat-alat yang digunakan untuk melakukan Tambang.dan juga Penertiban para penambang tanpa izin harus dilakukan  sehingga Tambang Liar atau PETI dapat berkurang .

",2011-05-10,digilib_unila,http://digilib.unila.ac.id/75/1/COVERzin.pdf,2026-04-14 10:12:22.669368+07
102,ANALISIS SEBELUM DAN DAN SESUDAH IMPLEMENTASI SAK ETAP ATAS PERLAKUAN AKUNTANSI ASET TETAP PADA PT.APMS,"Hadi Suyatno, DESSY HEDIANSYAH","Aset tetap dalam suatu perusahaan merupakan komponen aset yang nilainya relatif lebih besar dari aset lainnya. Untuk itu dibutuhkan kebijakan aset yang tepat, yang dinilai dari kebijakan cara memperoleh dan penentuan harga perolehannya, estimasi umur ekonomis, metode penyusutan yang digunakan, perbaikan dan penilaian kembali. Oleh karena itu pada tahun 2009 Ikatan Akuntansi Indonesia (IAI) mengeluarkan Standar Akuntansi Keuangan Entitas Tanpa Akuntabilitas Publik (SAK ETAP) yang lebih sederhana dibandingkan PSAK umum yang ditujukan untuk usaha kecil dan menengah seperti halnya PT.APMS.
PT. APMS adalah perusahaan UKM yang bergerak dalam bidang jasa kontruksi. Fenomena yang terjadi pada PT. APMS menyangkut aset tetap berwujudnya, yaitu dalam pencatatan aset tetap berwujud perusahaan tidak melakukan pemisahan, sehingga aset tetap yang dilaporkan oleh perusahaan sebesar harga perolehannya saja.
Analisa yang digunakan oleh penulis adalah analisis kuantitatif yaitu analisis yang dilakukan dengan membuat perhitungan-perhitungan yang diperoleh dari objek penelitian, serta analisis kualitatif yang merupakan analisis dengan membandingkan perbedaan perlakuan akuntansi aset tetap berdasarkan SAK ETAP yang dilakukan oleh penulis dengan perlakuan akuntansi aset tetap oleh perusahaan dengan teori-teori yang relevan dan selanjutnya dianalisis untuk dapat ditarik suatu kesimpulan.
Dari hasil pengujian kuantitatif dan kualitatif yang penulis dapat dari perusahaan bahwa sebagian besar perlakuan akuntansi aset tetap PT. APMS sudah sesuai dengan SAK ETAP namun ada beberapa perlakuan akuntansi aset tetap PT.APMS yang masih tidak sesuai dengan SAK ETAP. Dan Tidak terdapat perbedaan yang berarti atas perlakuan akuntansi aset tetap pada PT. APMS dengan perlakuan akuntansi aset tetap berdasarkan SAK ETAP.
Kata Kunci : aset tetap, UKM, implementasi SAK ETAP",2013-01-06,digilib_unila,http://digilib.unila.ac.id/77/1/ABSTRAK.pdf,2026-04-14 10:12:22.682323+07
103,"PENGARUH VARIASI TEMPERING TERHADAP STRUKTUR MIKRO DAN SIFAT TANGGUH BAJA K-460
(EFFECT OF TEMPERING VARIATION TO MICROSTRUCTURE AND TOUGHNESS OF STEEL K-460)","Ismail, MARDALENA","Telah dilakukan penelitian mengenai “Pengaruh Variasi Tempering terhadap Struktur mikro dan Sifat Tangguh Baja K-460”. Pengujian mikro menggunakan alat mikroskop optik, dan pengujian ketangguhan baja dilakukan dengan menggunakan alat uji impak charpy dengan menggunakan variasi tempering yaitu 450 ºC dan 550 ºC. Hasil pengujian mikro untuk sampel yang tidak mengalami perlakuan panas, terdapat fasa ferrit dan sementit. Sedangkan pada baja yang mengalami perlakuan panas untuk quenching dan tempering, baja yang diquenching menunjukan fasa martensit yang berbentuk jarum dimana pada fasa ini terjadi karena adanya proses pendinginan secara cepat yang membuat atom-atom bergerak dan tidak sempat berdifusi. untuk mikro yang mengalami proses tempering memperlihatkan struktur karbida speroidit, dimana ketika berada pada temperatur yang tinggi atau pemanasan sampai disekitar temperatur kritis A1 yaitu 723 ºC, dan dalam waktu yang lama maka sementit yang tadinya berbentuk plat atau lempengan itu akan hancur menjadi bola-bola kecil (sphere). Pada hasil uji impak memperlihatkan bahwa hasil terbaik didapatkan pada hasil tempering 550 ºC yaitu dengan nilai ketangguhan 0,08 J/mm2, dan hasil ketanguhan terendah terdapat pada baja yang mengalami quenching yaitu dengan nilai ketangguhan 0,04 j/mm2.
Kata kunci: baja karbon tinggi, pengujian impak, martensit temper, quenching.
(The research has been carried out about “Effect of Tempering Variation To Microstructure and Toughness Steel Of K-460”. Micro testing used optic microscopy and toughness testing used charpy impact testing with variation of tempering were 450 and 550 oC. The results of micro testing for sample without heating treatment including ferrit and cementite phase. The sample result occured by heating treatment of quenching revealed martensite phase which has needle shaped, this phase occurred because of rapid cooling process that makes the atoms move and no diffuse. Whereas the result of sample occured by heating treatment of tempering shown the structure of speroidit carbide, when it is located at a high temperature or warming up around the critical temperature A1 is 723 º C, and for a long time so cementite that had plate shaped will crumble into small balls (sphere). The impact testing results showed the best result obtained at 550 oC tempering with toughness value of 0.08 J/mm2 and the lowest value of toughness obtained at steel is quenched with toughness value of 0.04 j/mm2.
Keywords: high carbon steel, tempered martensite, quenching.)
",2013-12-23,digilib_unila,http://digilib.unila.ac.id/78/1/Cover.pdf,2026-04-14 10:12:22.688067+07
104,"VARIASI SUHU SINTERING DALAM SINTESIS SUPERKONDUKTOR Bi-2212 DENGAN DOPING Pb (BPSCCO-2212)
PADA KADAR Ca=1,10 (VARIATION OF SINTERING TEMPERATURE IN THE SYNTESIS OF Bi-2212 SUPERCONDUCTOR WITH Pb DOPANT (BPSCCO-2212) ON THE CONTENT OF Ca=1,10)","Iksir, MELI RATNA SARI","Bahan superkonduktor BPSCCO-2212 dengan kadar CaCO3 1,10 fraksi mol telah disintesis dengan metode reaksi padatan (solid state reaction method). Sintesis dilakukan selama 10 jam pada suhu kalsinasi (Tk) 800oC dan sintering selama 20 jam dengan variasi suhu (Ts) 815oC, 820oC, 825oC, dan 830oC. Tujuan penelitian untuk mengetahui pengaruh variasi suhu sintering terhadap tingkat kemurnian fase superkonduktor Bi-2212 yang terbentuk (fraksi volume (Fv), derajat orientasi (P), dan impuritas (I)). Hasil sintesis dikarakterisasi menggunakan XRD (X-Ray Diffraction) dan SEM (Scanning Electron Microscopy). Hasil analisis XRD menunjukkan variasi suhu sintering cenderung meningkatkan fraksi volume (Fv). Fraksi volume (Fv) pada Ts=815°C diperoleh 72,39%, Ts=820°C diperoleh 74,56%, Ts=825°C diperoleh 87,34%, dan Ts=830°C diperoleh 90,10%. Sedangkan derajat orientasi (P) pada Ts=815°C diperoleh 53,13%, Ts=820°C diperoleh 55,97%, Ts=825°C diperoleh 59,31%, dan Ts=830°C diperoleh 42,43%. Fraksi volume (Fv) relatif baik pada sampel yang disintering dengan Ts= 830°C yaitu 90,10%. Sedangkan derajat orientasi (P) relatif baik pada sampel dengan Ts=825°C yaitu 59,31%.
Kata kunci: superkonduktor, BPSCCO-2212, suhu sintering, fraksi volume, derajat orientasi.
(Synthesis of BPSCCO-2212 superconducting materials with CaCO3 1,10 mole fraction has been done using solid reaction method. Synthesis conducted with calcination for 10 hours at temperature of 800oC and sintering for 20 hours with sintering temperature variations (Ts) 815oC, 820oC, 825oC, dan 830oC. Sintering temperature variation was performed to determine the effect on the level of purity of the Bi-2212 superconducting phase is formed (volume fraction (Fv), the degree of orientation (P), and impurity (I)). The samples were characterized using XRD (X-Ray Diffraction) and SEM (Scanning Electron Microscopy). XRD analysis results showed variation of sintering temperature tended to increase the value of the volume fraction (Fv). Value of the volume fraction (Fv) on Ts=815°C obtained 72,39%, Ts=820° C obtained 74,56%, Ts=825°C obtained 87,34%, and Ts=830°C obtained 90.10%. While the value of the degree of orientation (P) at Ts=815°C obtained 53,13%, Ts=820°C obtained 55,97%, Ts=825°C obtained 59,31%, and Ts=830°C gained 42,43%. Volume fraction (Fv) is relatively well contained in sintering samples at temperatures 830°C is 90,10%. While the degree of orientation (P) is relatively well contained in the sample with Ts=825°C was 59,31%.
Key words: superconductors, BPSCCO-2212, sintering temperature, volume fraction, the degree of orientation.)",2013-12-23,digilib_unila,http://digilib.unila.ac.id/80/1/COVER%20DALAM.pdf,2026-04-14 10:12:22.693058+07
105,"Desain Reaktor Air Superkritis (Supercritical Water Reactor)
dengan Bahan Bakar Thorium","Sunarto, Rina Utami","Telah dilakukan desain Reaktor air superkritis (SCWR) dengan bahan bakar Thorium. SCWR didesain untuk memperoleh sebuah model reaktor yang menghasilkan daya termal tinggi dan berada dalam keadaan kritis. Parameter yang dianalisis dalam penelitian ini meliputi pengayaan bahan bakar, ukuran reaktor, kritikalitas, dan distribusi rapat daya. Analisis reaktor dengan teras yang berbentuk tiga dimensi (x, y, z) pada ¼ bagian teras menggunakan paket program SRAC pada bagian CITATION. Komposisi bahan bakar dan konfigurasi teras agar berada dalam keadaan kritis dapat diperoleh dengan memvariasikan pengayaan bahan bakar, ukuran reaktor dan konfigurasi bahan bakar di dalam teras. Bahan bakar SCWR menggunakan Thorium, cladding Stainless Stell dan Air ringan sebagai moderator sekaligus pendingin. Pada penelitian ini diperoleh desain SCWR dengan ukuran x = 85 cm, y = 85 cm dan z = 180 cm. Pengayaan bahan bakar 2,23 % untuk posisi inner fuel dan 1,5% untuk posisi outer fuel. Desain yang dibuat menghasilkan daya termal 1000 MWth, rapat daya maksimum 625,675 Watt/cc dan nilai k-efektif 1,000274.
Kata Kunci. Desain, SCWR, Thorium, Rapat daya",2013-12-23,digilib_unila,http://digilib.unila.ac.id/81/1/COVER%20DALAM.pdf,2026-04-14 10:12:22.703165+07
107,"PERAN PEMERINTAH DAERAH DALAM PENYELESAIAN SENGKETA
FASILITAS SOSIAL DAN FASILITAS UMUM PERUMAHAN
","Tanirun, Andri Wibowo","Sebagaimana disebutkan dalam Pasal 28H ayat (1) Undang – Undang dasar 1945 yang berbunyi Setiap orang berhak hidup sejahtera lahir dan batin, bertempat tinggal, dan medapatkan lingkungan hidup baik dan sehat serta berhak  memperoleh pelayanan kesehatan. Pembangunan perumahan sebagai kebutuhan dasar manusia, merupakan modal utama dalam pembangunan yang menyeluruh dan merata harus dilengkapi dengan pembangunan Fasilitas Sosial dan Fasilitas Umum. Sementara dalam Undang – Undang No 4 Tahun 1992 tentang perumahan dan pemukiman dalam konsideran Undang – Undang tersebut menyebutkan bahwa pembangunan seluruh masyarakat Indonesia,  pembangunan Perumahan dan Pemukiman yang layak, sehat, aman, serasi dan teratur merupakan salah satu kebutuhan dasar manusia dan merupakan faktor penting dalam meningkatkan harkat dan martabat manusia, mutu kehidupan serta kesejahteraan Rakyat dalam masyarakat adil dan makmur. Kemudian dalam Pasal 11 ayat (1) Peraturan Menteri Dalam Negeri No. 9 Tahun 2009 Tentang Pedoman Penyerahan Prasarana, sarana dan Utilitas Perumahan Menyebutkan bahwa dibentuk tim verifikasi oleh Pemerintah daerah Untuk Menerima penyerahan Fasilitas sosial dan Fasilitas Umum Perumahan. Dengan adanya Undang – Undang yang diatas Pemerintah memiliki peranan yang penting untuk penyelesaian sengketa perumahan.

Permasalahan dalam skripsi ini adalah 1) peran pemerintah daerah dalam penyelesaian sengketa Fasilitas Sosial dan Fasilitas Umum perumahan, 2) apa upaya yang dilakukan pemerintah daerah dalam menyelesaikan sengketa Fasilitas Sosial dan Fasilitas Umum Perumahan, 3) faktor penghambat dari penyelesaian sengketa Fasilitas sosial dan Fasilitas Umum Perumahan.

Penelitian ini dilakukan secara Normatif empiris yang mengunakan data primer dan data sekunder. Data primer diperoleh melalui studi lapangan sedangkan data sekunder diperoleh dari studi pustaka. Analisis data digunakan dengan cara analisis deskriptif kualitatif.

Berdasarkan penelitian yang dilakukan peran yang dapat dilakukan Pemerintah daerah adalah bertindak sebagai mediator dan memfasilitasi keluhan masyarakat terhadap ketidakadaan Fasilitas social dan fasilitas Umum Perumahan. Kemudian melakukan pemanggilan pada pihak – pihak terkait untuk dilakukan hearing, yang kemudian mencapai sebuah kesimpulan yanag seterusnya direkomendasikan kepada walikota setempat untuk dilakukan penyelesaian masalah seterusnya. Upaya yang dilakukan Pemerintah Daerahalah menginventarisasi lahan dan menjadi mediasi terhadap snegketa yang terjadi. Faktor penghambat dari penyelesaian sengketa Perumahan adalah, tidak adanya peraturan Hukum yang mengatur secara tegas tentang sanksi pelanggaran pembangunan fasilitas sosial dan fasilitas Umum perumahan, dan belum ada standar baku penyelesaian sengketa.

Disarankan kepada Pemerintah daerah agar dapat menciptakan suatu produk hukum yang mengatur secara tegas sangsi apabila melanggar standarisasi pembangunan fasilitas sosial dan fasilitas umum perumahan, dianjurkan kepada masyarakat untuk mengajukan kepada lembaga yang lebih berwenang dalam penyelesaian sengketa, dalam hal ini lembaga perlindungan konsumen lebih berperan apabila tertera dalam perjanjian jual beli Perumahan.
",2011-03-16,digilib_unila,http://digilib.unila.ac.id/83/1/ABSTRAK.pdf,2026-04-14 10:12:22.717406+07
108,PENGARUH PROSES PEMANASAN DENGAN VARIASI MEDIA PENDINGIN TERHADAPNILAI KEKERASAN DAN STRUKTUR MIKRO PADA BAJA KARBON SEDANG (EFFECT PROCESS OF HEATING WITH VARIATIONS OF COOLING MEDIA TO THE VALUE OF HARDNESS AND MICROSTRUCTURE THROUGH MEDIUM CARBON STEEL),"Sarimin, Dina Restia Ningrum","Telah dilakukan penelitian dengan variasi media pendingin terhadap nilai kekerasan dan struktur mikro pada baja pegas daun. Baja pegas daun dilakukan proses heat treatment pada temperatur 780oC selama 20 menit. Setelah itu baja langsung di dinginkan secara cepat (quenching)dengan media pendinginan yang berbeda yaitu udara, air, air garam, danoli. Sampel hasil perlakuan panas dan pendinginan dilakukan uji komposisi kimia, uji kekerasan, dan uji struktur mikro. Hasil penelitian menunjukkan bahwa pengujian komposisi kimia, baja pegas daun termasuk baja karbon sedang (0,57567% C),setelah proses heat treatment sampel tidak mengalami perubahan komposisi kimia. Hasil uji kekerasan nilai rata-rata tertinggi pada sampel yang menggunakan quenching air garam sebesar 61,25 HRC, nilai terendah pada sampel quenching udara sebesar 22,94 HRC, quenching air sebesar 59,45 HRC, tetapi pada sampel quenching air dan air garam terdapat keretakan pada permukaan dan quenching oli sebesar 58,54 HRC yang merupakan media pendingin yang relatif baik karena dapat meningkatkan nilai kekerasan tanpa mengalami keretakan pada sampel. Hasi lstruktur mikro pada sampel quenching udara menghasilkan butir-butir ferit dan perlit sedangkan pada sampel quenching air, air garam, dan oli menghasilkan butir-butir martensit dan austenite sisa. Semakin cepat laju pendinginan pada sampel, maka semakin halus butir-butir kristal dengan nilai kekerasan yang lebih tinggi, dan sebaliknya semakin lambat laju pendinginan pada sampel maka semakin besar butir-butir kristal dengan nilai kekerasan yang rendah.
Kata kunci: Baja pegas daun, proses heat treatment,quenching, uji kekerasan,struktur mikro.
(Research has been carried out with variations of the cooling media to hardness value and microstructure of leaf spring steel. Leaf spring steel was heated at temperature of 780°C for 20 minutes. Further process, steel was cooled quickly (quenching) with kinds of cooling medium, those were air, water, salt water, and oil. Samples of heating and cooling treatment were tested by chemical composition, hardness, and microstructure test. The results of chemical composition test showed that leaf spring steel include medium carbon steel (0,57567% C), after the heat treatment process samples were not occurred change of composition. The hardness testing revealed that highest average value in sample using salt water quenching HRC at 61,25, the lowest value in the sample using air quenching at 22,94 HRC, water quenching at 59,45 HRC and oil quenching at 58,54 HRC. Microstructure results in sample of air quenching produces grains of ferrite and pearlite, whereas the quenching samples of water , salt water, and oil produces grains of martensite and residual austenite. The faster of cooling rate in the samples generating the more finely crystalline grains with a higher hardness value, and conversely the slower of the cooling rate in the sample, producing the crystal grains were greater with low hardness values.
Keywords:leaf spring steel, heat treatment, quenching, hardness, microstructure.)",2013-12-23,digilib_unila,http://digilib.unila.ac.id/84/1/COVER%20DALAM.pdf,2026-04-14 10:12:22.722001+07
109,"PERAN DINAS PERHUBUNGAN KOTA BANDAR LAMPUNG
DALAM PERENCANAAN PEMBANGUNAN TRANSPORTASI PERKOTAAN
","Said Fahrizal , ARIE OKTARA","Perkembangan yang begitu pesat terkait jumlah penduduk di Kota Bandar Lampung tentunya akan berdampak dengan meningkatnya kebutuhan akan sarana transportasi, peran Dinas Perhubungan Kota Bandar Lampung sangat strategis sebagai salah satu instansi dalam mengurai permasalahan kemacetan yang terjadi, dan merupakan badan atau organisasi yang melaksanakan tugas pokok membantu walikota dalam menyelenggarakan pemerintahan di bidang perhubungan.

Pada dasarnya penelitian ini bertujuan untuk mengetahui Bagaimana peran Dinas Perhubungan Kota Bandar Lampung dalam perencanaan pembangunan transportasi untuk mengatasi kemacetan lalu lintas dan untuk mengetahui faktor-faktor apakah yang dapat menjadi penghambat dalam perencanaan pembangunan transportasi untuk mengatasi kemacetan lalu lintas di Kota Bandar Lampung.

Tipe penelitian yang digunakan adalah Pendekatan yuridis Empiris, yaitu pendekatan dengan cara melihat dan mempelajari literatur-literatur yang berlaku dan berhubungan dengan judul dan pokok bahasan yang akan diteliti, yaitu Peran Dinas Perhubungan Kota Bandar Lampung Dalam Perencanaan Pembangunan Transportasi Perkotaan dan meneliti data primer yang diperoleh secara langsung dari wawancara guna mengetahui kenyataan yang terjadi dalam praktek.

Berdasarkan hasil penelitian diperoleh kesimpulan bahwa Dinas Perhubungan Kota Bandar Lampung secara normatif memiliki desain yang cukup komprehensif. Berkaitan dengan perencanaan pembangunan transportasi perkotaan yaitu pembangunan jangka pendek, menengah, dan jangka panjang. sehingga pemecahan permasalahan kemacetan yang ada di Kota Bandar Lampung tidak hanya dilakukan secara temporal parsial (kasuistik, tergantung dengan persoalan yang terjadi dilapangan).
Adapun faktor-faktor penghambat pada Dinas Perhubungan Kota Bandar lampung dalam pembangunan transportasi perkotaan adalah : 1). Keterbatasan SDM terutama yang memiliki latar belakang pendidikan tenaga teknis perhubungan dan teknis sipil; 2). Prasarana dan fasilitas perhubungan masih sangat minim dan banyak terdapat fasilitas perhubungan yang mengalami kerusakan; 3). Masih rendahnya tingkat kedisiplinan aparatur perhubungan dalam mentataati peraturan yang telah ditetapkan oleh pimpinan; 4). Masih rendahnya pengetahuan dan prilaku masyarakat dalam mentaati peraturan lalu lintas; 5). Masih rendahnya keterlibatan masyarakat dalam menjaga prasarana dan fasilitas perhubungan; 6). Masih tingginya tingkat pencurian dan pengrusakan terhadap fasilitas lalu lintas; 7). Perbandingan antara kemampuan penambahan ruas jalan dengan laju pertambahan kendaraan bermotor di Kota Bandar lampung terlihat tidak seimbang.

Dengan adanya faktor-faktor penghambat tersebut maka Dinas Perhubungan Kota Bandar Lampung memiliki upaya untuk mengatasi faktor-faktor penghambat transportasi sebagai berikut : 1). Meningkatkan kualitas dan keprofesionalan aparatur Dinas Perhubungan melalui peningkatan kualifikasi pendidikan dan pelatihan Sub Sektor Perhubungan maupun pendidikan dan pelatihan lainnya; 2). Memfasilitasi kelancaran angkutan penumpang dan barang melalui penyediaan prasarana transportasi yang aman, lancar, tertib, teratur, nyaman dan efesien dan terjangkau; 3). Meningkatkan koordinasi dan kerjasama antara Pemerintah Pusat (Kementrian Perhubungan), maupun daerah guna menciptakan sinergitas cara kelancaran dalam pelaksanaan tugas; 4). Meningkatkan produktifitas ekonomi melalui penyediaan dan transportasi yang menunjang dan dapat menggerakan interaksi ekonomi mayarakat secara terpadu, tertib, lancar dan efesien; 5). Menunjang mobilitas masyarakat melalui peningkatan dan pemerataan penyediaan sarana perhubungan untuk segenap lapisan masyarakat; 6). Memelihara dan mempertahankan kualitas lingkungan melalui penyediaan sarana dan prasarana transportasi; 7). Memantapkan ketersediaan dan sumber pembiayaan kebutuhan penyediaan jasa dan pembangunan prasarana transportasi; 8). Menggali potensi sumber Pendapatan asli Daerah sektor transportasi.

",2011-04-16,digilib_unila,http://digilib.unila.ac.id/85/1/COVER.pdf,2026-04-14 10:12:22.727234+07
